i love being an asshole pic.twitter.com/c5x6fnafBI,sienaxmirabella,2017-05-20 07:54:49,
"For 110 billion, he probably sucked his balls while Jared sucked his asshole & Ivanka flashed titties... we know what these people are about",FakeBoobsNews,2017-05-21 03:59:55,
"YOU ARE NOT DUMB, SHE WAS BEING AN ASSHOLE . DON'T LISTEN TO HER.",grumpyKarkat,2017-05-21 03:59:36,
If you turn an asshole inside out your left with a lot of shit! Plenty to go around lately!,tolson_ronald,2017-05-21 03:59:31,
"""I'm exhausted."" Lays across Sans' bed like the asshole she is.",KaliDreemurr,2017-05-21 03:59:29,
"he pants and moans and sobs in the shower, fingering his asshole while desperately fucking his hand, whining yoongi's name quietly",cherubjjk,2017-05-21 03:59:21,
"He's so gay, even his asshole has a lisp",brenofnsc,2017-05-21 03:59:08,
That was an asshole move on my part,Pixnshovel,2017-05-21 03:59:00,
What is it like to constantly make yourself look like such an incredible asshole ?,Am_I_Shouting,2017-05-21 03:58:58,
You know when you post a selfie on Instagram and suddenly get self conscious cause there's always some asshole judging the shape of ur pupil pic.twitter.com/cCaQJ7Mtmo,Ap_ollo_,2017-05-21 03:58:31,
I would be this guy/ asshole for sure. Boleta es la actitud correcta https:// twitter.com/nochillposts/s tatus/866074055371362305 …,CesarAReveron1,2017-05-21 03:58:31,
Wow that's like sayin I wished your mom swallowed you instead of allowing the neighbor to jizz in her asshole https:// twitter.com/harry1t6/statu s/865991004951859203 …,HawkinsWally,2017-05-21 03:58:30,
When you have to miss your eyebrow apt you JUST made bc you can't find your keys and your bf is a ASS HOLE and won't take you.,Rylee_Dawn,2017-05-21 03:58:18,
Well when isn't my literal asshole trying to tell me something am I right,_KatieF,2017-05-21 03:58:18,
Cutest asshole ever haha. He'd love you,FrugalHugo,2017-05-21 03:57:59,
Obama coulda clued him in if Trump wasn't such an asshole about it. Trump is 1 of those men who have to pee on the electric fence #resist https:// twitter.com/AgendaOfEvil/s tatus/866070925413818369 …,rosevalenta,2017-05-21 03:57:58,
All show like #PresidentSnowflake . This asshole wants to arrest the million Americans he figures are terrorists and suspend Habeas Corpus. https:// twitter.com/darionavarro11 1/status/865983814027288576 …,DanDoepke,2017-05-21 03:57:34,
That reminds me I once had a beloved “Jesus Love You/ Everybody Else Thinks You’re An Asshole ” shirt from @DinerRoadster .,femphil,2017-05-21 03:57:30,
kevin: oh shit this juice is bangin yo gwen: its paint asshole,snivies,2017-05-21 03:57:28,
He is 100% asshole so I'm OK with that,Jennifer_T4232,2017-05-21 03:57:22,
"So you *weren't* on here explaining how you're not an asshole for refusing to use preferred pronouns, etc?",Gr8SageEqlofHvn,2017-05-21 03:57:19,
Fucking AJ Pierzinski. Biggest asshole to ever play for the Giants,sfgiantsfan021,2017-05-21 03:57:17,
In SoCal it is currently as hot as the devils asshole,envyJD,2017-05-21 03:57:15,
#FursonaAppreciationDay I can't choose between them. 1. Ty: main Sona 2. Aurora: favorite open species 3. Ti: female Ty 4. Leo: an asshole pic.twitter.com/Nc9EBlbWmD,Tyminster5,2017-05-21 03:57:13,
Someone just asked me if the key in my wrist was the key to Brians asshole . I'm sorry what???,LCbabyxo7,2017-05-21 03:57:11,
Forsake me please... you little asshole ... My new neighbors biggest creeps going..,michele088,2017-05-21 03:56:56,
"Am I the only asshole who's seen ""Midnight Express""? Why were they here?!?!",Jannrickles,2017-05-21 03:56:37,
"'This Trump thing?!?' Are all of the GOP morons, or just this asshole ?!? #WaPo #cnn #msnbc #foxnews https:// twitter.com/washingtonpost /status/866079346817208321 …",bambUSAled,2017-05-21 03:56:25,
"If that asshole governor likes that scumbag so much he needs to take him in to his home. Hell, if he has kids and room's are tight double up https:// twitter.com/eeynouf/status /866078297112944640 …",DonnieKeptman7,2017-05-21 03:56:19,
"""stfu before I slap you with my asshole """,gabygauthier96,2017-05-21 03:56:10,
"I am a complete wothlrss asshole . Everything I touch I lose or destroy. My computer is broken, my TV won't turn on, and I lost my Fitbit.",TB5918,2017-05-21 03:55:58,
"The actual Bogey Man only gets 92% negative press. But, he's less of a crooked, lying asshole , so that makes sense.",shanragirl,2017-05-21 03:55:54,
I'm just trying to be an asshole ! But j do miss writing lolz. Proud of you,FrmTheSouthBlog,2017-05-21 03:55:48,
I read this as if your literal asshole was trying to tell you something and I got so confused,dyl_barrett,2017-05-21 03:55:46,
That's so great! I hope that asshole shit in his pants!,Cyndifferous,2017-05-21 03:55:46,
"Sheriff David Clarke: Live by the asshole , die by the asshole .",shoutabyss,2017-05-21 03:55:45,
Ch. NISAR kaan khool ke sun lo. Fuck off you bastard. Catch me if you can. #ReleaseOwaisAndSalar or I will make your parody Ass hole,JaanJee_,2017-05-21 03:55:41,
Asshole . https:// twitter.com/cozyceo/status /866076272715337728 …,ImportedFrmGuam,2017-05-21 03:55:18,
He is the Asshole of our planet Sheesh!!!,LuckyLuna07,2017-05-21 03:55:16,
Sometimes I wish I could be an asshole,Samuel_77_Rae,2017-05-21 03:55:07,
Im an Asshole I say anything on twitter,king_poppin,2017-05-21 03:55:03,
"How does that sentence go? Once is careless, twice is ..., 47 times is an asshole .",mycariads,2017-05-21 03:54:47,
We kno u ain't an asshole fam.....well at least I kno ur not https:// twitter.com/9ersNtrojansfa n/status/866078570291920896 …,PerkDawg229,2017-05-21 03:54:42,
@curtis_redford you can have your girlfriend back. SHE IS AN ASSHOLE,thecoolasian_,2017-05-21 03:54:32,
I've known you since you were a 1 year old asshole,jaredbuchmeier,2017-05-21 03:54:24,
#MAGA = Malicious Asshole Genuflects Awkwardly pic.twitter.com/bPe7jmjbUQ,TDPattillo,2017-05-21 03:54:24,
美女のお尻に発射したくなったらRT pic.twitter.com/3L2Af8GrtM 激カワギャルとチャットして アポ→即マン♡ セフレ探しならガールズチャット♡ http:// dxsr.pjx.jp,beauty_ass_hole,2017-05-21 03:54:21,
"Amazing. If Hillary Clinton had done 1/10 of what this asshole 45 does, she would be impeached & thrown out. #angrywhitemaleprivilege",caragal_,2017-05-21 03:53:51,
"BEES HELP US LIVE, ASSHOLE .",underdanigroyk,2017-05-21 03:53:49,
Have ya ever noticed that a freezer door ice system works in the same way as an asshole ??? With the whole double sphincter???,emmascarn,2017-05-21 03:53:37,
Had a good night & then you had to go ruin it asshole,kellyyxng,2017-05-21 03:53:24,
You're not the only one into the things you're into. Don't be an elitist asshole . Let other people like it too.,BunnySummerz,2017-05-21 03:53:07,
What an ASSHOLE #GrabMeByThePussy,KoreanPoundCake,2017-05-21 03:52:58,
_________ looks like she can fuck but she such an asshole on twitter,daddykn0sbest,2017-05-21 03:52:56,
"TRUMP Supporters don't just kiss hes ass, they actually have managed to crawl up hes ORANGE ASSHOLE and kiss it from the INSIDE LOL",XCOGAMES,2017-05-21 03:52:47,
Oh no Charlie's becoming an asshole,awkwrdParacadet,2017-05-21 03:52:36,
asshole,shelbkathryn,2017-05-21 03:52:30,
shut the fuck up u asshole,naabiilaaaa,2017-05-21 03:52:29,
Are you really an asshole ? — Not really but sometimes https:// curiouscat.me/Masshole93/pos t/151269317?t=1495324349 …,Masshole93,2017-05-21 03:52:29,
Tight asshole .,JBNitty,2017-05-21 03:52:27,
@calvinclive20 he didn't die but two lions paid the price for thi asshole . WHY? he should be jail.,wickedclown037f,2017-05-21 03:52:12,
Clarke is an asshole . The countries loss in getting this dick is Wisconsins gain in getting rid of him. https:// twitter.com/kfile/status/8 66040037204525056 …,DEsInfiniteLuv,2017-05-21 03:52:03,
I'm such an asshole driver,ItsLizzyyyyyyy,2017-05-21 03:51:59,
When you bout to fuck but then her asshole more hairy than yours pic.twitter.com/MKNML7MHeN,INITIALGOON32,2017-05-21 03:51:55,
Asshole credit card companies are trying to screw up my shredder,dudeitsshoe,2017-05-21 03:51:54,
Looks like I'm going to need to pick up some wasp spray tomorrow. Asshole bugs.,MadynnMads,2017-05-21 03:51:50,
"Oh noooooo. Yeah, playing that way makes me feel like an asshole . D:",PushinUpRoses,2017-05-21 03:51:49,
That asshole has a master's degree? I feel cheapened.,BobFishell,2017-05-21 03:51:47,
I'm gonna go get my ass beat practicing to dodge that asshole,marshymaaaarsh,2017-05-21 03:51:47,
"When your ""friend"" who treats you like shit stans someone who was an asshole to you but you have no friends so you sit there and just pic.twitter.com/xdzt2Llcx6",lockhartfan28,2017-05-21 03:51:42,
Bitch I'm the shit like I came out an asshole,_BreBurns,2017-05-21 03:51:38,
"me: puts up a huge wall between me & irls, kinda an asshole , makes it clear i dont want to hang out me: why dont ppl make plans with me:(",pseudosIeep,2017-05-21 03:51:30,
I'm asshole -phobic I dare these people to come at y... — I DARE THEM https:// curiouscat.me/superqueerx/po st/151282225?t=1495324277 …,bgItquake,2017-05-21 03:51:18,
I jus saw wat my college dorm looks like n like the rooms r so small n I GOGGA SHARE HOW AM I SUPPOSED TO GAPE MY ASSHOLE THERE???,darkskintdemon,2017-05-21 03:51:11,
Good. James Neal is an asshole . I'm not sorry about it.,whathappnd,2017-05-21 03:51:09,
this is definitely some asshole shit I'd do pic.twitter.com/fjxw8BiKi5,JacquelynVenter,2017-05-21 03:51:07,
this is definitely some asshole shit I'd do pic.twitter.com/47ZoJxhota,SilvesterUTXE23,2017-05-21 03:51:06,
SHUT UP YOU NASTY FAT ASSHOLE,omar_alr,2017-05-21 03:50:58,
I cant have an egomaniac in ma team. Who do u think u are ? Please know ur position... ITS BENEATH ME U ASSHOLE,daddyseng,2017-05-21 03:50:58,
A railroad? They need a crane to move that fat ass hole,ManzoniJanet,2017-05-21 03:50:56,
The same asshole who makes up fake news like this.,Brutallhonest_C,2017-05-21 03:50:56,
—sad asshole noises. https:// twitter.com/xkennxthsmr/st atus/866005602623008769 …,fatbxy_spr,2017-05-21 03:50:55,
What an asshole .,tlweng74,2017-05-21 03:50:52,
You fucking asshole,Lovely_Niecey,2017-05-21 03:50:47,
"Calling Trump's bow a curtsy & suggesting he's an effeminate loser for doing it accomplishes 1 thing, it proves you're a homophobic asshole .",appsbymarc,2017-05-21 03:50:46,
Make Macho Asshole Racist Pussy Grabbing Conmen Curtsey Again pic.twitter.com/08M7zMapAf,GrassoSeba1,2017-05-21 03:50:25,
"... Also: as a career-long Bold Truth Teller, I know how easy is to slip into being an asshole (because it's SO much easier than truth)",marick,2017-05-21 03:50:24,
Excuse me... I'm no asshole,Jus2Run,2017-05-21 03:50:18,
Says the asshole who's done eating and still sitting at Bubba's pic.twitter.com/d92hxRpoNa,nik_631,2017-05-21 03:50:14,
i cant believe you can tell a pigs gender by their asshole,Glaringglasses0,2017-05-21 03:50:12,
@Theme_guy IS TRYING TO MURDER ME WITH ASSHOLE EDUCATION. HELP.,7DaysLuck,2017-05-21 03:49:59,
"You literally blocked the guy because he called you "" ass hole "". Are you okay, snowflake? Pathetic.",BetoGarRam,2017-05-21 03:49:56,
I don't mean to sound like an ass hole here but he shouldn't have said what he did and gone the route he took. MLK didn't worry 2 much,9ersNtrojansfan,2017-05-21 03:49:56,
And my wife said I'd never get anywhere being an asshole . Ha!,geokelley,2017-05-21 03:49:47,
My teammate is an asshole ! https:// clips.twitch.tv/PunchyEncourag ingShrimpDoritosChip …,Militant_TV,2017-05-21 03:49:30,
That's some real live ass hole shit but idgaf,Bajan_K,2017-05-21 03:48:58,
Lol he was an asshole so it was justified. That was waaaaaay back in high school tho lol,sciorra_,2017-05-21 03:48:50,
And this is the asshole who said the Dixie Chicks were unAmerican. #FUTK https:// twitter.com/dan_davis86/st atus/866042855780954114 …,not_p_harris,2017-05-21 03:48:49,
Tammy is messy and a damn liar. Then she tagged BBCAN5 like an asshole .,ReneeNicoleMcDo,2017-05-21 03:48:49,
Why would you serve Irish coffee like this I look like a fucking asshole now pic.twitter.com/X8AUZjIX8K,JordanFreiman,2017-05-21 03:48:47,
I'm glad not many people know that I'm an asshole,livhippie,2017-05-21 03:48:43,
Shorty annoying he say I'm a asshole,_BreBurns,2017-05-21 03:48:36,
My asshole is burning,amanda2k17,2017-05-21 03:48:33,
When you try to attack Trump but you just end up being a sexist asshole https:// twitter.com/tariqnasheed/s tatus/866001628637175808 …,_JohnPawl_,2017-05-21 03:48:32,
@the person who has great sex but there such an asshole u couldn't fuck them ...again,daddykn0sbest,2017-05-21 03:48:31,
if you drive a crown vic for fun you're an asshole,zoie_rose,2017-05-21 03:48:19,
#henry will always be my special boy #guarddogs #frenchie #labrahound #asshole https://www. instagram.com/p/BUVUmeGhtUX/,manicgoldfish,2017-05-21 03:48:13,
Or he has & he's the same kind of scary conservative asshole that character is,benfromcanada,2017-05-21 03:48:12,
I'm very discouraged.. if @POTUS picks asshole Dudley dope @JoeLieberman kiss his admin presidency goodbye ... https:// twitter.com/robertbtracy/s tatus/866066965466554368 …,barkmartin,2017-05-21 03:48:11,
uhm... That he's so sweet and thoughtful that you have to look like an asshole next to him?,omfgloloakley,2017-05-21 03:48:11,
keemstar is an asshole,anthony47599437,2017-05-21 03:47:54,
it's hotter then the devils asshole rn dude wtf,jaedilla_,2017-05-21 03:47:40,
"......and oh yeah support other people, don't be an asshole .",A_S_Prod,2017-05-21 03:47:29,
ようやくFuckin' asshole 仕事が終わったぜ これで4連休だ！,CaptainYumo,2017-05-21 03:47:06,
Dating an asshole named steven https:// twitter.com/rpflquestions/ status/681522337938718721 …,FirstLadyWaysMK,2017-05-21 03:47:05,
Im a good looking mother fucking asshole according to my step fam. Lit,Theedjchavis,2017-05-21 03:47:03,
"""All people enslaved other people; white people were just really good at it."" THAT'S NOT SOMETHING TO BRAG ABOUT ASSHOLE !!! https:// twitter.com/ThatDudeMCFLY/ status/865928033026408448 …",HoratioCorn2,2017-05-21 03:46:56,
"OGs @you cunt, I do get it asshole",Wak3n,2017-05-21 03:46:53,
*PUCKERED ASSHOLE * pic.twitter.com/ZI7GySI0Rc,notKoze,2017-05-21 03:46:51,
Literally no bc w/o me Lightning would've gone free from Radiator Springs and stayed an asshole,its_sallycars,2017-05-21 03:46:42,
Ok maybe not yelling I'll use a different word. Asshole is that better?,BradleyJay02,2017-05-21 03:46:37,
"I mean, she's not wrong, it IS harder to be a transphobic asshole ….",00d4n1_ebooks,2017-05-21 03:46:30,
i can't tell if ur serious if u do then ur the asshole,cbrezzy1_,2017-05-21 03:46:28,
it's different being called an asshole vs a dyke or fag,nostunkelocin,2017-05-21 03:46:25,
Lavar Ball went from an entertaining dumbass to an asshole real quick.,fzlongotoon,2017-05-21 03:46:25,
"Tasia you're a lil asshole , now I see where I get it from. lol",Dayana510,2017-05-21 03:46:19,
Wow. I really really feel like an asshole now. #PlotTwist,TheeChrisLondon,2017-05-21 03:46:12,
I heard about this last year. Have had this asshole on my shitlist since them. What kind of person does this? Seriously,CindibiseniusOr,2017-05-21 03:46:10,
"my asshole ? you're my everything, hinata-kun.",lilith_en,2017-05-21 03:45:55,
Unless you're an asshole @Mtn40A @JettuJagga @mprinvale @MsViciousVixen @Vaani_Singh @MySweetings https:// twitter.com/WiseWilbert/st atus/866075821554970626 …,SafkhetC,2017-05-21 03:45:49,
Unless you're an asshole @Mtn40A @JettuJagga @mprinvale @MsViciousVixen @Vaani_Singh @MySweetings https:// twitter.com/WiseWilbert/st atus/866075821554970626 …,SafkhetC,2017-05-21 03:45:48,
"Like, I swear to god I'm not trying to be an asshole here, but they would probably be better off forfeiting...",TylerMoliterno,2017-05-21 03:45:42,
"John Oliver called Trump ""A Shrodinger's asshole ""!!!!!!!!! I think that's the funniest thing I've ever heard!!!",Kitty866,2017-05-21 03:45:42,
so basically the main convo us girls have had today is boys are asshole,MattieDolan,2017-05-21 03:45:30,
His face looks like a puckered asshole ..Reminds me of when I walk my dog & it's squatting 2 take a Trump..I mean a Dump! #ORANGEJULIUSCAESAR,drunkenspirit,2017-05-21 03:45:23,
I swore off punk for years when my 7th grade math teacher was an asshole and also was the og bassist of the #theweirdos #punk,deadwall,2017-05-21 03:45:13,
He's an asshole for saying it,Tamirrt1,2017-05-21 03:45:06,
Carrie Beasley fucked rough in the asshole by a stepbrother http:// tubeen.com/video/carrie-b easley-fucked-rough-in-the-asshole-by-a-stepbrother-154714.html …,carmenPorn,2017-05-21 03:45:03,
then Akira eats it out of goro's asshole,tenmiiko,2017-05-21 03:44:58,
"John Fowles, despite being a consummate, damaged asshole irl, was a favourite author of mine for a while.",redlibrarian,2017-05-21 03:44:55,
I think we all have that asshole ring tone for certain people. My wife's was the bitch song for a while lol,marvelzombiek,2017-05-21 03:44:45,
I'm an asshole with a big heart,xgotninelivesx,2017-05-21 03:44:37,
"""You threw rocks at me asshole "" ""Well you threw mud at me first"" Oups love you!! #hewasbehindme #plasteredhiminmud #mykindarelationshipgoals",breexo29,2017-05-21 03:44:28,
David Clarke is an ignorant asshole Coward. FACT.,iambillhello57,2017-05-21 03:44:15,
"motivational instagram meme video with some asshole ""expert"": you can live on 6 hour sleep",nimalcrackers,2017-05-21 03:44:09,
Looking for the asshole who stole #teds wallet he's wearing a tan and black striped hoodie and has white gauges #rockontherange #lettedknow pic.twitter.com/m4MNCf3ytN,CollierTristan,2017-05-21 03:44:09,
"Wasn't really worth the anxiety spike over breaking news, dude is still an asshole though. https:// twitter.com/KFILE/status/8 66075038553919489 …",linzlovesyou,2017-05-21 03:44:09,
Simply stated most all blowhard Democrat politicians and pubdits are unadulterated 100% pure ASSHOLE .,JamesDoss50,2017-05-21 03:44:09,
I'm not gonna pat that asshole on the back,ChipReiderson,2017-05-21 03:44:06,
"I believe that, sometimes a brother can be an asshole though remember that.",MBTreazrae,2017-05-21 03:43:55,
"#OldGranny #MomsFucking #SaggyTits , #PissFlaps : Girl In Maid Dress Getting Her Asshole Pussy Fucked With... http:// tinyurl.com/z6jtwet",amateur_mums,2017-05-21 03:43:32,
"Tbh I hate whenever someone uses that ""sorry I was drunk"" excuse to justify being an asshole .",_ASAPventa,2017-05-21 03:43:29,
uhh I've never accepted the word asshole until I got to know you lol! I love you so very much!!! It's actually hurt pic.twitter.com/4VewKMYC9U,LAYAL113,2017-05-21 03:43:24,
Gershon is a punk. Less cred than Trump. Asshole he is big time. @2602Watertown,ANTambo,2017-05-21 03:43:16,
nah nah you're still an asshole but at least you know it haha,chaseproway,2017-05-21 03:43:13,
Karmies can suck my asshole,paperhrtts,2017-05-21 03:43:13,
"Some asshole I'm my neighborhood called me a ""trany"" and told to suck a dick at least my friend held me back",caseywestfall10,2017-05-21 03:42:50,
"just apologize, asshole",onlinetakes,2017-05-21 03:42:48,
"@MAHAMOSA if you are a parent, would you let those dumb fucking asshole parade your baby around like that fuck you would",NTS78833483,2017-05-21 03:42:45,
how'd you see my asshole https:// twitter.com/hirayeon/statu s/866075885983682560 …,BootyCrumb,2017-05-21 03:42:43,
"So what Preds player ""told on"" Getz that he called him a bad word? Tattle tale asshole #LetsGoDucks #StanleyCup",MarkVivLexCA,2017-05-21 03:42:34,
IM NOT A TEEN ANYMORE IS IT STILL ALLOWED,WaywardMcBride,2017-05-21 03:42:34,
Can someone explain who the hell Lavar Ball is and why he's such an asshole ?,els22oli,2017-05-21 03:42:32,
I don't think the Third Lady would be someone I'd like even if she wasn't married to the Tangerine Asshole . https:// twitter.com/thehill/status /866076343792001024 …,Hugh2D2,2017-05-21 03:42:25,
You're an asshole but I love you,_yRios,2017-05-21 03:42:24,
"I ain't his biggest fan, but I really appreciated him for this. This level of asshole is appreciated by an asshole such as myself. https:// twitter.com/andyvstheworid /status/865683298223349766 …",Youngyates3024,2017-05-21 03:42:22,
"They are hunting Polly with hounds??? What stupid, ignorant, asshole bitches are the Blossoms??? #Riverdale",Toobi2011,2017-05-21 03:42:21,
All I do is talk shit I'm a asshole,TriggaaRu,2017-05-21 03:42:14,
Hahaha youre an asshole not her this time,bgubzxo,2017-05-21 03:42:09,
so that fat asshole died,lachupalibre,2017-05-21 03:42:09,
this is definitely some asshole shit I'd do pic.twitter.com/hQHZT6Be1o,NoraFemia3691,2017-05-21 03:42:08,
this is definitely some asshole shit I'd do pic.twitter.com/DPSZzgLOsc,SilvanaCokely92,2017-05-21 03:42:07,
"-- tongue continued to work on her gaping ass hole as she questioned him.] “Mhm, baby... You taste so fucking good, the flash has no --",OfSpeedGodisms,2017-05-21 03:42:01,
#nude #naked #horny #sexy #pussy #ass #boobs #asshole 30$ for 30 mins on cam with me LETS CUM TOGETHER pic.twitter.com/46uUozVAMW,CamgirlBia,2017-05-21 03:41:55,
"His argument with @CornelWest sickened me. @billmaher is a piece of shit. Then ""it's time for new rules"" Knows he looks like an asshole",Harleydadd,2017-05-21 03:41:54,
"Every time I see this asshole , I think Mel Brooks is trolling us. https:// twitter.com/pbump/status/8 66075888739389441 …",tant1ne,2017-05-21 03:41:45,
this is definitely some asshole shit I'd do pic.twitter.com/IviV55lt1O,CythiaWillougby,2017-05-21 03:41:40,
"For people like that I have ""an asshole is calling"" ringtone",Rasors_Edge02,2017-05-21 03:41:38,
this is definitely some asshole shit I'd do pic.twitter.com/w3q0Xlc41p,MerriAringtonQW,2017-05-21 03:41:38,
"the last action sequence in that planet I didn't like lol... btw David an asshole huh, never trusting a David haha",ONdres43,2017-05-21 03:41:37,
"unless someone is being an asshole and actually attacking a group/artist for no logical reason, then it's merely an opinion",wonhorai,2017-05-21 03:41:35,
IM AN ASSHOLE THAT HATES SEEING PPL CRY. SMH WHATS WRONG WITH ME,UncleKobe1,2017-05-21 03:41:31,
"As long as you're not a racist sexist asshole about it, we can all enjoy. https:// twitter.com/tayorified/sta tus/866038424792322048 …",thepoliticalcat,2017-05-21 03:41:26,
"Hoppa want to be a real asshole to mi eeeehehhh wat da blodclot for . Don't think I shall be turning up on ""New Level"" @djarems",iamjahmocha,2017-05-21 03:41:24,
If Trump admits he's an asshole ... I'd feel a little better about him.,Horn_In_D,2017-05-21 03:41:21,
asshole,jhoppper23,2017-05-21 03:41:19,
What an asshole https:// twitter.com/KFILE/status/8 66075038553919489 …,mtrem2,2017-05-21 03:41:12,
"Yea addison is a total ass hole to most ppl. Loves me, tolerates people who have fed her before and are around a lot. Hates dudes",JustLeslieCat,2017-05-21 03:41:08,
now i gotta go from good neighbor to concerned citizen asshole if he gets behind the wheel,THP_Music,2017-05-21 03:41:05,
I say you leave the country until you stop being an asshole .,OtterMtn,2017-05-21 03:40:53,
"I called my dad an asshole (I was rlly young) and my oldest brother said ""kristin hide on the roof the will never find you""",alaviekiss,2017-05-21 03:40:52,
S.O. To @maddy_turcotte hope your mouth heels well!!! It sucks asshole I know but eat lots of pudding!!!,emily_bechand,2017-05-21 03:40:50,
Totally interpretive. My take is why does that asshole use a necklace that is MEANT to show subservience?,PaulEga2261,2017-05-21 03:40:43,
Anal3 (Rough Anal) #anal #rough #porn #xxx #nsfw #sex #Anal #Asshole http:// roughanalsex.pornlog.co/2017/05/20/ana l3-rough-anal-17/ …,RealNakedWomen,2017-05-21 03:40:40,
"If you are to be an asshole , swallow it and actually acknowledge it. Admit it is a tragedy and it is awful, then you can joke.",AregonAlmighty,2017-05-21 03:40:37,
"- you're such an asshole , go fuck yourself - Why not just fuck me instead & make things easier? - *silence*",riky_ofs,2017-05-21 03:40:36,
Nah go eat asshole https:// twitter.com/gwacheonult/st atus/866076020222439424 …,OMORll,2017-05-21 03:40:28,
"Ding dong, the bitch is dead, mother fucker! (Gah, I've been wanting to kill that asshole since I thought him up.)",Miz_Erie_,2017-05-21 03:40:25,
Just because he's an asshole doesn't necessarily make him a white supremacist.,njblueshirt367,2017-05-21 03:40:25,
Why do people keep telling trump how he can fire Mueller?He doesn't need help being an asshole . #Trumprussia #impeachtrump,oshkoshwriter,2017-05-21 03:40:19,
Jughead's dad is such an asshole . #Riverdale,Toobi2011,2017-05-21 03:40:19,
