So you take Putin 's side. Thanks for clearing that up.,arembooks,2017-01-21 03:59:51,
What the fuck dude. Not very Christian of you to be such an asshole. Good lord. Has Putin gotten to you too?!? #FUCK https:// twitter.com/jasoninthehous e/status/822542036486225923 …,tfergpdx,2017-01-21 03:59:49,
How soon can we start the impeachment proceedings? @realDonaldTrump @POTUS #usa #democracy #collusion #putin #EmolumentsClause,CarlettoAtWork,2017-01-21 03:59:49,
im pretty sure that person has never been to a museum. Putin approves of trump's decisions pic.twitter.com/OMmrlwlJy3,TheEntropicMan,2017-01-21 03:59:40,
@maddow Please make mention how Trump THANK Putin in the beginning of his speech #trumpleaks @TheLeadCNN @NBCNews @HuffingtonPost @nytimes,MoodyliciousSpa,2017-01-21 03:59:33,
First thing is you'll bring Putin to the WH so you can have a kissing partner,Marjee123,2017-01-21 03:59:32,
when is Putin taking control probably middle of the night #putinsbitch,irishlghts,2017-01-21 03:59:30,
Congrats on voting in Putin 's bitch....,sathinator,2017-01-21 03:59:27,
"yeah, I forgot. It's Putin . Love your sense of humor man. You must be a liberal.",0Boyd0,2017-01-21 03:59:25,
DEMS PLEASE STOP MAKING IT EASY FOR PUTIN +FOR PUTIN 's PEOPLE HERE. THEY ARE THE WORST TRAITORS OF USA!,StageYaneu,2017-01-21 03:59:25,
if Putin didn't need to find a way to fund his failing domestic economy he wouldn't b there,DaBlackGriot,2017-01-21 03:59:25,
@SenateGOP @SenJohnMcCain #TraitorTrump say he& amp;Putin talk&he'sAmazing https:// twitter.com/ShaunKing/stat us/819177036056907780/video/1 … + #CONway pic.twitter.com/Bs0qC81Xl9 https:// twitter.com/jentaub/status /822551176566755328 …,Willtalksoup,2017-01-21 03:59:22,
"The Beeb are reporting a worldwide right and extreme right coalition across the world of Putin , Farage and Trump... http:// shr.gs/2jQSy4U",Barrettd1984,2017-01-21 03:59:22,
"Notice how the flooding of ""patriotic tweets"" has dwindled? That's because #Putin ordered his trolls to cool it. #TrumpInauguration",L_HANK,2017-01-21 03:59:22,
ohne Schutz ..da denke ich an Putin der sowas auch macht,RainerMartinetz,2017-01-21 03:59:21,
Venezuela otorga a Vladimir Putin el premio “Hugo Chávez a la Paz” http:// bit.ly/2k1umAJ - pic.twitter.com/ppOcgyLZsu,ElBilluyo,2017-01-21 03:59:20,
"ko Putin i Medvedev, ili Milo Đ. i Filip V. :))",lavljeg_srca,2017-01-21 03:59:18,
Yes he is looking for carnage; trying to inspire a terrorist attack on us (wipe them off the face of the earth) like Putin staged in Moscow https:// twitter.com/nytimes/status /822578722947600384 …,JudyCorradi,2017-01-21 03:59:15,
Putin doesn't drink,Rickandgary,2017-01-21 03:59:14,
"Thank you. And any excuse they need, they'll create. Putin was good at that.",Philip_J_Powers,2017-01-21 03:59:14,
Exactly! The SOB's are supported by the Soros & his dozens of Leftist groups. Mr. Putin already ordered to arrest Soros.,jtblogs,2017-01-21 03:59:12,
Trump&Tillerson & EXXON& Putin have too much oil money on the line for that! How much crude needs processed and marketed is in Russia? https:// twitter.com/BssDeRothschil d/status/822379612290154496 …,mindshrugged211,2017-01-21 03:59:12,
"Well first of all, he didn't fiends with Russia he said he respects Putin . And none of those things are ""policy"" so...",Premium_US1,2017-01-21 03:59:10,
#NotMyPresident EVER. Putin can keep his grubby hands off USA.,Olivia_Emisar,2017-01-21 03:59:07,
"John Kerry, the ‘rubber face’: “Dynamics of Syrian War Shifted the Day Putin Went in” https:// daveyone1.wordpress.com/2017/01/20/joh n-kerry-the-rubber-face-dynamics-of-syrian-war-shifted-the-day-putin-went-in … pic.twitter.com/Rijqvzt4kl",BoycottFamilyLw,2017-01-21 03:59:00,
@madampresidn @PalmerReport @DailyNewsBin watch Trump videos on my home page. Putin is lying for Trump re relationship. DT owes VP,IreneDifJen,2017-01-21 03:58:58,
Putin should be proud: Trump's America is a rotten place http:// wpo.st/de6T2,coopeydoop,2017-01-21 03:58:57,
"Schön, mal gegen eine demokratische Wahl zu demonstrieren. Als Putin ""gewählt"" wurde, sind sie vermutlich auf dem Sofa geblieben. https:// twitter.com/berlinerzeitun g/status/822517049234690048 …",oliverfink,2017-01-21 03:58:56,
The only pawn in this game is Putin 's presidential pawn.,cryptotrade,2017-01-21 03:58:55,
"John Kerry, the ‘rubber face’: “Dynamics of Syrian War Shifted the Day Putin Went in” https:// daveyone1.wordpress.com/2017/01/20/joh n-kerry-the-rubber-face-dynamics-of-syrian-war-shifted-the-day-putin-went-in … pic.twitter.com/5BJ0i7oRuM",Daveyone1,2017-01-21 03:58:54,
#trump drained the swamp indeed. @POTUS @MoorheadFiona #TrumpInauguration #Trump @DonaldJTrumpJr @MELANIATRUMP potus/ putin ? pic.twitter.com/ZxSp7W6tww,ahlondoner,2017-01-21 03:58:49,
@realDonaldTrump Great.I could see President Trump that you may not be finished with the Clintons and Sorros overall. Putin wants Sorros,ianjonesoverse1,2017-01-21 03:58:46,
@paulza70 Will Trump's first act of office be to grab Russia by the Putin ?,StillGameClub1,2017-01-21 03:58:44,
https://www. youtube.com/watch?v=rbc2NT pJIv4 … даaaaaaaaaaaaaaaaaaaaaaaaaaaaaaaaa #Russia #USSR #CCCP #Putin #Stalin #MemeNightFriday,Cipher_Zero_0,2017-01-21 03:58:43,
"""Adieu l'Amour"" pic.twitter.com/5wCP7kwDKg",AidaXidirova,2017-01-21 03:58:40,
"Putin será muy de derechas y homófobo, pero ha evitado que la gente de Aleppo estuviera ahora sin cabeza o muriendo de frío en Serbia.",Konspyrenayko,2017-01-21 03:58:40,
president Putin,mikedamdo,2017-01-21 03:58:39,
"No wonder Putin loves @realDonaldTrump - with hands like those, he must make putin 's dick look #YUUGE",NucleotideSoup,2017-01-21 03:58:37,
@FordKiernan1 Will Trump's first act of office be to grab Russia by the Putin ?,StillGameClub1,2017-01-21 03:58:31,
"Trump's plans for making America great is making him unpopular with other countries- lose of friends. This is what Putin wants. USA,USA,USA",Stikine,2017-01-21 03:58:29,
"Steve, he won with the help of comey and putin , forget crowd size.",PsychicMilou,2017-01-21 03:58:27,
"""Crowd comparison. L: Obama-2009, R: Trump-Today. Only Putin -2012 has less people."" https:// twitter.com/KermlinRussia/ status/822485420214747137 …",Pigmeich,2017-01-21 03:58:24,
#Ironic you have time to say nude model looks great but no tIme to speak on Putin -Trump deleting minorities from WH page,charlottamarsha,2017-01-21 03:58:24,
"no, blaming Russians makes you look bad. Tell me, how did Putin influence my vote?",MattC_36,2017-01-21 03:58:23,
What if Trump isn't the real threat? What if it's Barron? What if Putin and Trump fixed the election to groom Barron for world domination?,brubendall,2017-01-21 03:58:23,
In Russia if you speak against Putin you ether end up in a body bag or in prison. And this person is popping champagne to Trump winning.,YanLebedev23,2017-01-21 03:58:18,
@GavsterNo1 Will Trump's first act of office be to grab Russia by the Putin ?,StillGameClub1,2017-01-21 03:58:15,
Putin Will Have Loved RT’s Coverage of Trump’s Inauguration http:// putin.trendolizer.com/2017/01/putin- will-have-loved-rts-coverage-of-trumps-inauguration.html …,Putinizer,2017-01-21 03:58:15,
Putin has one of Robert Kraft's rings. Robert Kraft and Brady are down with Trump. What the fuck is really going on?,Atwitisborn,2017-01-21 03:58:14,
Google News: VIP treatment: Special health clinic planned for Putin 's elite - Reuters https:// goo.gl/fb/vGkzyZ,GunvorWatch,2017-01-21 03:58:11,
"Hang on, isn't Putin President now?",EdRummery,2017-01-21 03:58:02,
@greghemphill96 Will Trump's first act of office be to grab Russia by the Putin ?,StillGameClub1,2017-01-21 03:58:00,
Trump populista nada popular: 40% iniciando mandato.Obama sale con 60%. Protesta en varias ciudades EE.UU y UE.Maduro espera señas de Putin ?,Davidovis,2017-01-21 03:57:59,
"""trump is the worst""... lol they haven't been paying attention to what putin doing all these years, have they?",tsetiady,2017-01-21 03:57:50,
Vladimir Putin didn't go to his inauguration--SAD!,Charles_Vail,2017-01-21 03:57:50,
Yes likes trump for the Putin puppet he is! Better brush up on your Russian!,Fillows4,2017-01-21 03:57:44,
@TomthunkitsMind But very dangerous. Putin always whispering into Trump's unbalanced brain.,elainejul,2017-01-21 03:57:43,
Putin took it down.,2duckfeet,2017-01-21 03:57:42,
"Putin already has your throat, he will take you mind too. Beware!",shintakezou_it,2017-01-21 03:57:39,
"Tearing each other apart without finding common cause is playing into the hands of Putin , Trump, Petry, Le Pen &c.",phineasfrogg,2017-01-21 03:57:32,
. @iyad_elbaghdadi You can watch what Trump's new biz partner Putin has done to society in E Ukraine in detail here: https://www. youtube.com/watch?v=TNKsLl K52ss&list=PL9LU5JnQpdzfLiz3Og8g02r_ZoBraoH0Z …,andyrosebrook,2017-01-21 03:57:30,
Yo les tengo verdadero temor es a Putin y a Trump que tienen el mayor arsenal militar y nuclear del mundo.,JezirZapataC,2017-01-21 03:57:26,
"I've said often that Putin -Trump USA will be Putin -Yanukovych Ukraine, 2010-14. Today, Washington was treated to ""titushky"" thug violence.",mhmck,2017-01-21 03:57:25,
"you can, allot of us want the investigation into putin , I with John Lewis",Skyisthelimit10,2017-01-21 03:57:23,
Putin sending help https:// twitter.com/nytopinion/sta tus/822582244887982080 …,agent_orangutan,2017-01-21 03:57:11,
"en manos de putín , se pueden entender , pero , seguirán enfrentados políticamente, para definir quien va a mandar, en planeta,",jorgema57341981,2017-01-21 03:57:06,
If I see Putin I want to touch his NECK,CanOfPineapples,2017-01-21 03:57:04,
"Would love seeing you chop Putin with one of your patented slaps followed with a ""Wooo""",mgilliga,2017-01-21 03:57:01,
Surprised Putin didn't fill with holograms. https:// twitter.com/SamGrittner/st atus/822593557575958530 …,TheeBrandon_R,2017-01-21 03:57:01,
Putin,Koru101,2017-01-21 03:57:00,
@SenateGOP @SpeakerRyan #TraitorTrump say he& amp;Putin talk&he'sAmazing https:// twitter.com/ShaunKing/stat us/819177036056907780/video/1 … + #CONway pic.twitter.com/Bs0qC81Xl9 https:// twitter.com/le_gorafi/stat us/822530624678494208 …,Willtalksoup,2017-01-21 03:56:58,
"There are Americans today who think less of women assembling to protest than they do of Putin . Wake up. You're in a cult, call your dad.",coldantlerfarm,2017-01-21 03:56:57,
Is the US becoming a police state - advice from Putin on how to control the populace.Orwell's Animal Farm 2017 version @GuardianAus #auspol https:// twitter.com/GuardianAus/st atus/822593217963106305 …,JOorloff,2017-01-21 03:56:55,
Ban islam Ban @georgesoros President Putin is looking for you!,FowlerFinVenice,2017-01-21 03:56:52,
"really Netanyahu is on Twitter? So, where's Putin ? Come on Vad...Tweet in Russian most Trump supporters will understand you.",Cedarflame,2017-01-21 03:56:51,
Putin is building international coalition of far-right parties that let him get away w/ expansionist foreign policy: http:// whitehatmag.com/editions/2017- winter/putins-code-war/ … https:// twitter.com/sarahkendzior/ status/822557194025635841 …,Chrisella,2017-01-21 03:56:47,
Putin 's not the loser here! LOL @AndyRayYT @TrumpInaugural @POTUS #DeploraBall #DeplorablesForTrump #stolenelection pic.twitter.com/pQo38UZb6u,Artnunymisss,2017-01-21 03:56:38,
is his ally and EuropeUnion no longer worthy of $$$--Only wants to do business with Putin https:// twitter.com/kasparov63/sta tus/822552335855611904 …,Sharonb57470441,2017-01-21 03:56:38,
Putin is a dictator,dogrucun,2017-01-21 03:56:38,
"Trump's speech today, sounded like he doesn't want to do anything internationally and perhaps he's leaving it to someone else, Putin ? #deal",benjenks,2017-01-21 03:56:36,
Putin we did it!! #realDonaldTrump #45THPresident,45thPresidentDT,2017-01-21 03:56:25,
Putin 's boyfriend,dtaylor601,2017-01-21 03:56:23,
Make him go away with a bottle of vodka and a picture of Putin . Than he will be A to drunk or B to buisy with getting drunk to do anything,Jmax528,2017-01-21 03:56:11,
You should be ashamed of yourself. How could you stand in solidarity with a Traitor who colluded with Putin to get elected. #Impeachment https:// twitter.com/jasoninthehous e/status/822542036486225923 …,Dar_Thatcher,2017-01-21 03:56:06,
@HJJoyceEcon How do you feel about Putin / A NEW WORLD ORDER zIONIST OR NOT,kennydogleash7,2017-01-21 03:56:03,
Did you seal it with wet slurpy kiss for the pussy grabber? Or are you saving that for Putin ? Burr chooses foreign nationals over US #ncpol https:// twitter.com/SenatorBurr/st atus/822592797022810112 …,mrbabypants,2017-01-21 03:56:01,
Why do people keep saying that the voters have spoken? Isn't there a mountain of evidence pointing to Putin haven spoken?,TigerSharkMusic,2017-01-21 03:55:58,
#Trump despierta miedo pero no respeto. Como Putin . Como Kim Jong-un. vamos mal,KDVin,2017-01-21 03:55:58,
rejected cheetoh is Putin 's bitchboy so yeah don't be to proud he won't last,Cdragon71,2017-01-21 03:55:57,
@realDonaldTrump tells boyfriend Putin to begin moving the troops. Pick a country...any country. Invade it as a reward for helping Adolf T!,CitizenObscura,2017-01-21 03:55:54,
Putin told him to do it!,meanjean28,2017-01-21 03:55:54,
or get Putin to?,trixied13,2017-01-21 03:55:51,
"Be quiet Kornacki how much reporting did YOU do about Trump & his incestuous ties w/ Putin & Russia? Stop riding your ""Bridgegate""coat tails.",debelwar,2017-01-21 03:55:42,
"@realdonaldtrump And if u are familiar with Ian Fleming, she was CREATED to give Putin the ultimate tool (and I do mean TOOL)",T_Callanan,2017-01-21 03:55:40,
Funny part is that even Israel was betting on Hillary. Trump was always meant to be a fall guy but Putin pulled the unthinkable stunt.. #ZH,sabeqoon,2017-01-21 03:55:33,
.@baileycapili says #Russians will love our show. So where are you? Out ice swimming with #Putin today? Say hi. http:// bybpod.com/episode25,bybpod,2017-01-21 03:55:30,
Just another right-wing hack funded by #Putin . Nothing to see here,SchwaebischeAff,2017-01-21 03:55:26,
"This is an authoritarian Fascist move just like Hitler, Putin , Stalin, Mussolini & leaders in China have done. https:// twitter.com/bholton/status /822586794474672130 …",RobinH2222,2017-01-21 03:55:24,
Putin 's piñata? @Auditorium Shores https://www. instagram.com/p/BPgWBxllnFoS ckkuL2px6YWVtrJ-Ae7eFqCWME0/ …,AWildKate,2017-01-21 03:55:23,
http://www. thegaytimes.com Trump's Inauguration Fireworks Seem To Have Paid Tribute To BFF Vladimir Putin !,TheGayTimes,2017-01-21 03:55:18,
Hilarious you talking about PUTIN REPUBLIKKKANS making the Moon Shine! Yea real jobs!,leech11,2017-01-21 03:55:13,
Jjaja ¡Mielda! ¿En ese orden de ideas Putin es Ra's Al Ghul ? https:// twitter.com/darkobowie/sta tus/822507012403687425 …,AndrEs_Fand,2017-01-21 03:55:07,
Sorry we're not going to be dragged into WW3 just b/c they're mad Putin exposed their dirty gambit in Syria..,SeaBassNeely,2017-01-21 03:55:04,
Don't thank me. Thank the Electoral College and Putin .,simongloom,2017-01-21 03:55:04,
"Steven Seagal about Obama, Putin , Russia and the US. He told everything !!! https:// youtu.be/cHzgwwJDHGI via @YouTube",mary_f12,2017-01-21 03:55:02,
Why wasn't Putin holding @realDonaldTrump bible today in a show of transparency? #Inauguration,imanelgammal,2017-01-21 03:55:00,
@BlogsofWar wow. Putin got his Syrian bases.,tomjsikora,2017-01-21 03:54:54,
Trump is Darth Vader to Putin 's Senator Palpatine https:// twitter.com/panamadip/stat us/822500970085154816 …,nealwithana1,2017-01-21 03:54:49,
I was once asked to follow Putin on Russian Facebook but I didn't want to.,Glinskus,2017-01-21 03:54:46,
"In the ME & in Europe, Trump cannot concede turf to Russia.He will be forced to confront Putin .But within US,Trump would b a disaster #ZH",sabeqoon,2017-01-21 03:54:40,
No. #RESISTANCE . Trump and his wannabe Nazis can go straight to Hell. Putin can drive the bus that takes the there.,Lawrence_n_DC,2017-01-21 03:54:36,
Putin 's puppet regime in place http://www. politicususa.com/2017/01/20/tru mps-act-president-raise-mortgage-rates-struggling-homeowners.html …,word_deCoupe,2017-01-21 03:54:32,
"sii Sr...pero que los extremistas recalcitrantes no canten victoria, Trump a demostrado ser impredecible y aliado de Putin ..",dazabrazil2014,2017-01-21 03:54:31,
"Trump better be damn careful. He just has no idea what he's messing with, and Putin won't save him.",dperry913,2017-01-21 03:54:31,
The only #mandate #Trump has is the regular one he's got with #Putin #Putinspuppet #Trump45,Jefferson_Locke,2017-01-21 03:54:29,
I didn't say it was. I said the evidence for Putin putting trump in place was the same as WMD in Iraq,HallSamm,2017-01-21 03:54:28,
"entiendo que hay un acuerdo con Putin para combatir al ISIS, que hay motivos ulteriores para hacerlo, no me caben dudas",VickyngaQueen,2017-01-21 03:54:28,
Is that putin 's vodka? https:// twitter.com/davidmackau/st atus/822488751159083010 …,MikeyAndMarilyn,2017-01-21 03:54:28,
Putin would've won. https:// twitter.com/mmurraypolitic s/status/822505705844461568 …,elkmating,2017-01-21 03:54:27,
He has balls. They are in PUTIN 'S purse. pic.twitter.com/5szLMXQafz,SteelToeTruth,2017-01-21 03:54:25,
"Just @Putin next time, okay? https:// twitter.com/potus/status/8 22572484742488065 …",tobykuhnke,2017-01-21 03:54:16,
"Qué nos ha hecho Putin !! Si tan moderados soys los errejonistas, ala, al PPSOE con viento fresco",Stelladeeli,2017-01-21 03:54:16,
"But for the US itself,Trump is just another name for disaster.They are celebrating in Russia today & rightly so. Putin did it.Stunning.. #ZH",sabeqoon,2017-01-21 03:54:12,
I thought Putin would have sent his world famous prostitutes to fill in the seats.,BriansHotRead,2017-01-21 03:54:10,
@Snowden @cnn Can't #Putin pull strings to make #Puppet @POTUS #Trump lick his A$$ & let you come #home to live in a vile land? @MoscowTimes,Navy23Vet,2017-01-21 03:54:10,
Almost makes ya nostalgic for Uncle Dubya....wait for his moment with Putin . https:// youtu.be/i4wKg2Ddoas,Boombearjr,2017-01-21 03:54:08,
Dr Jill Stein is a fraud. A puppet. A fifth columnist in the pocket of Putin .,AckerooBanzai,2017-01-21 03:54:07,
so Soros sponsors BLM but Putin didn't give u your President? White supremacy at its best,nickey1974,2017-01-21 03:54:07,
"Idealizar político nunca é positivo. Seja ele o Putin , Obama ou o Lula.",apenasdutra,2017-01-21 03:53:59,
#PerezHilton Trump's Inauguration Fireworks Seem To Have Paid Tribute To BFF Vladimir Putin !. Read Blog: http:// owler.us/ab7cVe,personal_ser,2017-01-21 03:53:55,
Why Putin wants to be Trump's friend. pic.twitter.com/legs414nmC,malcolmsimpson,2017-01-21 03:53:55,
Ni siquiera papá Putin es tan rudo como el señor Trump https:// twitter.com/30SECONDFlGHTS /status/822477033343217664 …,tan_daniel07,2017-01-21 03:53:49,
Cual siameses. Medran las orejas de Putin . De aplaudir.,carlosgtome,2017-01-21 03:53:49,
Putin running out of outsiders to blame. His economy will never be fair now he has nobody to blame....,MrMurder37,2017-01-21 03:53:42,
"yes,Obama IS responding for All the disasters!And Putin ,Assad etc...Are pure Angels!Hahaha!You should stop to write such bullshit",GuyBourgaud,2017-01-21 03:53:35,
Well the fun part is over. Now trump has to putin the hard work,turntupmaz,2017-01-21 03:53:20,
La teta de Putin .,luisitomarce,2017-01-21 03:53:18,
Do you guys think DJT is sad that Putin hasn't tweeted about him yet today,ByErinWeaver,2017-01-21 03:53:18,
LOL - attacking liberals while defending Putin . The Nation is absolute SHIT now.,ngmcclernan,2017-01-21 03:53:15,
I'm telling you Putin has laid out his plan to really screw over this country Trump is such an idiot cause he thinks Putin likes him,Marjee123,2017-01-21 03:53:14,
because putin helping a campaign is so american. repuicans lost right say unamerican after putin helping trump.,RockerThompson,2017-01-21 03:53:14,
"The links, subtle & not so subtle, just keep stacking up, linking him 2 Putin more & more & more. IMPEACH this BASTARD",carmenlynn1970,2017-01-21 03:53:11,
Putin https:// twitter.com/DNCpeep/status /822592715821088772 …,kasinca,2017-01-21 03:53:08,
"This shit needs to be put down, give soros to putin see if that helps or shoot a few https:// twitter.com/AmyMek/status/ 822296415800086528 …",vinniekniffen,2017-01-21 03:53:08,
he sided with Putin against Obama and they were good with it.,Carma_2012,2017-01-21 03:53:06,
Point is to pressure Dem pols and dem pols pressure corp media to keep Trump- Putin corruption up front. Tax returns a piece of the puzzle.,putridpepe,2017-01-21 03:53:05,
"And last time I checked, Drumpf was/is Putin 's Puppet, so how exactly is that American?? #DrumpfTardsAreStupid pic.twitter.com/PkLKIQKUK5",ZomBKillinQueen,2017-01-21 03:52:56,
President Putin is already reversing the EPA laws.,sandyfeet611,2017-01-21 03:52:53,
"#Trump ppl gloating over ""libs crying"" are misreading the situation. We're angry an ILLEGITIMATE, Putin puppet ""won"" a compromised election",DaTwilightZone,2017-01-21 03:52:46,
"Because Vladimir Putin was unavailable, @FoxNews had the settle for Nigel Farage as contributor. https:// twitter.com/grynbaum/statu s/822482670995259393 …",tightline88,2017-01-21 03:52:46,
"all the while HRC and BO, sold our uranium to Putin , yet they say you are in tight w/ Putin , to keep focus off them!!",TAGITKY,2017-01-21 03:52:45,
@TeflonXDon Putin 's party ?,NICKEIR,2017-01-21 03:52:39,
sure trust putin ...fuck those canadians though https:// twitter.com/puppygrammy/st atus/822590905110634498 …,millarly,2017-01-21 03:52:38,
Putin debo'd robert kraft https:// twitter.com/irepdcsports/s tatus/822591499892297734 …,freshxdesign,2017-01-21 03:52:37,
"its as if he's like, ""crap"". Yeah well this is what you get for conspiring with Putin !",TFerrandino,2017-01-21 03:52:28,
"people are excusing him siding with Putin against a sitting POTUS, they will excuse a dead American.",Carma_2012,2017-01-21 03:52:27,
@NativeDoty OLD LIZARD EYES IS GOING DOWN let's turn his treasonous butt over to Putin,penny63434309,2017-01-21 03:52:25,
WHAT VLADIMIR PUTIN JUST SAID ABOUT TRUMP TODAY MAKES OBAMA LOOK LIKE A ... https:// youtu.be/0I2Kt7Cra4s via @YouTube,julirish,2017-01-21 03:52:25,
"And by ""people"" you mean "" Putin "" right? https:// twitter.com/realDonaldTrum p/status/822502135233384448 …",Shereste,2017-01-21 03:52:22,
"If it weren't for the Serviceman behind Trump, I'd of thought Putin was in front of them. https:// twitter.com/CNNPolitics/st atus/822591290160381953 …",IsItUpOrDown,2017-01-21 03:52:17,
"If you look at Putin 's frown here, you can see Trump's mouth! pic.twitter.com/1RlkjZy3u0",tonyhex,2017-01-21 03:52:16,
Solo por detrás de Putin,Melvin_I9,2017-01-21 03:52:13,
Morgan Freeman ou le mec qui peu importe le rôle qu'il joue te met une grosse claque dans la gueule à chaque fois. Je l'aime putin !,Swanny_Universe,2017-01-21 03:52:10,
"Vendo pessoas falando ""ah porque tu é contra trump o que trump vai fazer putin nem sabe quem somos"" eles sabem mais do que a gente pensa.",Linmanuella,2017-01-21 03:52:09,
There will be nothing left when Putin ’s Puppet is finished doing Putin 's bidding. https:// twitter.com/yeowiecat/stat us/822591372783919107 …,TheDudeSeesAll,2017-01-21 03:51:58,
So Putin should have accepted NATO's relentless eastward expansion & Washington's coup in Kiev without demur? #naiveté,IRanalyst,2017-01-21 03:51:46,
Exit: President who stood up to and killed Bin-Laden. Enter: Putin 's bitch. https:// twitter.com/aclu/status/82 2269368142823424 …,StIves72,2017-01-21 03:51:46,
"Most US Pres attempts to cover up their own dom crimes have failed miserably.For all our warts,we're still quite far from #Putin 's mobocracy https:// twitter.com/gentlystream/s tatus/822519457931141120 …",submergingmkt,2017-01-21 03:51:36,
Trumpsters and puking putin WOW. That's all I can say. So now the Repugs are supporting communism? Russia is... http:// fb.me/8hfcZxBlC,ronnieray61,2017-01-21 03:51:31,
Putin jsp koi faire demain,Moha_Ghr,2017-01-21 03:51:20,
"they were probably hired by DT and his inner circle ( putin ) to distract from the peaceful protests just blocks away, 20k ppl",jb4demusa,2017-01-21 03:51:15,
Dear #j20 rioters... having a CCCP Soviet flag and anti Trump/ putin signs together doesn't make sense #Inauguration,DaPoliticalPunk,2017-01-21 03:51:13,
"YEA, PUTIN WAS REALLY SCARED OF HILLARY!",Billy_Inghram,2017-01-21 03:51:10,
Putin while watching the #Inauguration pic.twitter.com/uJ6i0oG9tG,ShaunGuillan,2017-01-21 03:51:05,
"With Putin , nothing happened. Trouble with media in the US",SuperLesin,2017-01-21 03:51:03,
"wtaf. She does realize that Putin is Satan, right?",youmethetardis,2017-01-21 03:51:03,
Traitor in chief? Says the guy who elected a con man huxter who has Putin 's dick firmly planted between his lips. You may fuck off now. https:// twitter.com/JoshHollingsw1 0/status/822591383433318400 …,Notbuyingthisbs,2017-01-21 03:50:56,
"AMEN, Only with God's help!! All of satan's forces were/are still against Trump. Putin & USA patriots did not bite on NWO's baited war.",Eyes_of_justice,2017-01-21 03:50:51,
Putin : now Donald about the daily bj... Trump: I t...t..thought you were joking. Putin : I never joke pic.twitter.com/5bwhMukyLv,Wanderer_RN,2017-01-21 03:50:47,
"they should buy some 200,000 spf sunscreen. I think the Trump/ Putin team is going to make some noise",bryang_g,2017-01-21 03:50:26,
