"@POTUS 's paper thin ""America First Foreign Policy"" makes cozying up to Putin a top priority. pic.twitter.com/7edFZhEjxU",NefeshHaGer,2017-01-21 03:14:00,
"Austrian far right signs deal with Putin 's party, touts Trump ties http:// reut.rs/2hiQUfa via @Reuters #PutinsBitch #Trumputin",debv219,2017-01-21 03:13:58,
"so true. The transfer of power from an intellect 2 a silly man who loves groping pussy, golden showers& Putin ! Putin puppet!",ReauxJeanne,2017-01-21 03:13:57,
http://www. huffingtonpost.com/entry/trump-in augural-address_us_588255e2e4b070d8cad2379d … #TrumpInauguration #Putin #Oligarchy OLIGARCHIES The world has changed now Trump and Putin sit in the I Towers,bjarnekim,2017-01-21 03:13:54,
"Hmm, @BBCNewsnight Isn't @BuzzFeedBen more sure that it's Putin 's paw prints?",clim8resistance,2017-01-21 03:13:45,
or your lover boy Putin,kneenee1,2017-01-21 03:13:43,
putin je dois réviser tout le week-end pic.twitter.com/71q4ZLWUHY,maureseus,2017-01-21 03:13:41,
LasVegasSun: Putin reacts to realDonaldTrump in the White House in today's cartoon. https:// lasvegassun.com/news/opinion/s miths-world/ … pic.twitter.com/RQ3UOxwsDY #real …,thejimfonggroup,2017-01-21 03:13:40,
so wait are we just going to ignore that whole fiasco about putin and drump being up each others asses like what happened about that,kenzieleigh66,2017-01-21 03:13:36,
"Aiding and abetting Putin , Korea's nukes, China trade war, Gambia's unpeaceful transfer of power, all should give... http:// fb.me/96Hvw1y2K",RyanGierach,2017-01-21 03:13:34,
#buttonyourcoat Orange Putin needs to button his coat.,mr_bluetown,2017-01-21 03:13:34,
…and then I found “Vladimir Putin Action Comics” and I fell down the internet well. http:// vladimirputinactioncomics.tumblr.com/post/2582409204,thesterlinggold,2017-01-21 03:13:30,
Bill Moyers: We need the truth about Trump’s relationship with Putin — NOW http:// ln.is/www.rawstory.c om/201/AN6i3 …,bmangh,2017-01-21 03:13:29,
Ignore the Putin puppets,easy5050,2017-01-21 03:13:25,
Putin,LornaGarey,2017-01-21 03:13:24,
Putin sent congratulatory Russian hooker. White House staff disapproves. Just locker room business! They'll come around. #ResistFromDay1,MrVonClownstick,2017-01-21 03:13:22,
"yea, it is all rightist international nationalist conspiracy directed by putin thru his russian hackers who control media and anarchists https:// twitter.com/thunderf00t/st atus/822582123362140160 …",M_Konigsmarck,2017-01-21 03:13:21,
Putin 's Puppet Is Going Down Son !,walloopia,2017-01-21 03:13:15,
"Присоединяюсь к Поздравлению!...Только не склоняйте Трампа к БЕЗВОЗМЕЗДНЫМ Гуманитаркам, Он к ПРОСТОФИЛЬСТВУ не склонен, ей-ей?!",svbssb,2017-01-21 03:13:14,
At least Putin knows how to turn out the crowds...,marktspence,2017-01-21 03:13:13,
"So, you're saying that #DonaldTrump is Putin 's puppet...",truevisualpoet,2017-01-21 03:13:12,
@realdonaldtrump was installed by Putin therefore will be removed post haste. #notMyPrersident Ever.,kasinca,2017-01-21 03:13:08,
Putin reacts to @realDonaldTrump in the White House in today's cartoon. https:// lasvegassun.com/news/opinion/s miths-world/ … pic.twitter.com/RI24sKBbKi,LasVegasSun,2017-01-21 03:13:02,
"@mashagessen Why do you think Trumpers romanticize Putin /Russia, instead of being cautious? It boggles my mind, Masha, these ""patriots"".",banjolizard55,2017-01-21 03:13:01,
Putin reacts to @realDonaldTrump in the White House in today's cartoon. https:// lasvegassun.com/news/opinion/s miths-world/ … pic.twitter.com/WR7bDvFfdO,DrawingTrump,2017-01-21 03:13:01,
Putin reacts to @realDonaldTrump in the White House in today's cartoon. https:// lasvegassun.com/news/opinion/s miths-world/ … pic.twitter.com/08QVipzFUd,smithtoons,2017-01-21 03:13:00,
#ARD + #ZDF #Trump + #Putin böse #Clinton + #Obama toll #EU Friedensprojekt #Ukraine Junta + #Nato toll Internet böse #Merkel toll pic.twitter.com/yFbxp1BcbL,teleherzog,2017-01-21 03:13:00,
no. That would be Putin . @JohnAMcCloskey @PoliticusSarah @AndyRichter @politicususa,MJoyce2244,2017-01-21 03:12:58,
"American Presidential inauguration on the left, Russian Presidential inaugural on the right. #Putin pic.twitter.com/prwC3yHKOJ",Can_ada,2017-01-21 03:12:57,
I know Jordan. Is it because she is a woman or because she isn't Putin ?,panininef,2017-01-21 03:12:57,
"Trump supporters at the Inauguration, stunning. Give Putin a cabinet position, said one. http://www. motherjones.com/politics/2017/ 01/trump-inauguration-voters-putin-obamacare-video … via @MotherJones",poetisa828,2017-01-21 03:12:56,
Thanks Putin !,Shanbrarian,2017-01-21 03:12:55,
So you prefer golden showers from Putin ?,easy5050,2017-01-21 03:12:50,
@bomani_jones Putin has video - ain't nobody getting a ring or anything else back - Putin hooked people up and recorded it then snatched it,JWilliams3434,2017-01-21 03:12:48,
I'm glad you realize it was Russia lbgive you props for telling the truth. Putin is ur president pic.twitter.com/A6P0hXHIZT,tpradia,2017-01-21 03:12:40,
A double feature: Donald #Trump in The Man With The Golden Gun Vladimir Putin in The Spy Who Loved Me #BadlyRecastAFilm #TrumpInauguration,MSeeseTweets,2017-01-21 03:12:38,
@bomani_jones Putin and the Super Bowl ring #radiogenius,cfair75,2017-01-21 03:12:37,
"Iran is equal to Russia and Trump likes Putin , so come to your conclusions.",Wasfe,2017-01-21 03:12:37,
"Putin ça fait du bien un petit discord avec c'est potes, sans travail pour ce soir ! :D ça ma régénérer",BluzziMC,2017-01-21 03:12:33,
With help from Putin & Comey. U must be so proud TRAITOR!!,ABswl16,2017-01-21 03:12:25,
@Anotherfilmnerd I feel like Putin should be Kuato and Trump should be the body portion of the twin.,DigitalSneeze,2017-01-21 03:12:18,
@guardian Time to run a daily tally of the phrases shared by both the Trump administration and RT/ Putin ? Do some fancy data viz?,curiousben,2017-01-21 03:12:18,
"Trump es mega populista, es CFK en un país que regula al mundo, con pasado empresarial pero admirando a Putin #bombadetiempo",Gemma_VB,2017-01-21 03:12:16,
"Been awhile since I've argued with some ""political"" people. Today could be interesting. Also, the quotes isn't a jab at little Putin .",canadagraphs,2017-01-21 03:12:12,
"Does anyone agree that Putin and Russia's DNA is all over this presidency, election, business enterprises and cabinet? Very dangerous!",JafJeffrey,2017-01-21 03:12:07,
"Looking forward to the first Trump, Putin and May group photo. Been after a screensaver for a while",Sunderland1879,2017-01-21 03:12:00,
#Putin is probably enjoying the #EmptySeats #Inauguration http:// vitw.it/link/rdnaL,My3Alexandra,2017-01-21 03:11:55,
"Starting the way he plans to go forward -- by oppressing people, supporting fascism, and licking Putin 's proverbial balls. #showusyourtaxes https:// twitter.com/people/status/ 822575464657068037 …",HarperKingsley0,2017-01-21 03:11:49,
Putin !!!!,SullivanTiago,2017-01-21 03:11:47,
Or Putin .,DanTisch,2017-01-21 03:11:43,
"Víte, na jaký nástroj hraje VV Putin ? No přece na Trumpetu.",CuriousEuropean,2017-01-21 03:11:35,
"No, He said Putin was a strong leader and is trying to start a partnership with him",thelegoryan,2017-01-21 03:11:33,
@realdonaldtrump hillaryclinton @QWorldStar @cthagod president_vladimir_ putin https://www. instagram.com/p/BPgRAvPhEYm/,BayouCutie1423,2017-01-21 03:11:31,
@SenSanders (Watch for a secret meeting between DJT and Putin (Enquirer),lewis_dr,2017-01-21 03:11:28,
"Impeach Trump. Overthrow Putin and Medvedev. God save the Queen. Long live and love the SAS, SBS, GCHQ, Mi5 and Mi6.",GipperSW7,2017-01-21 03:11:27,
"That's what I'm so scared, I can see Trump and Putin starting WW3. War is profitable for the wealthy.",JossiAtheist,2017-01-21 03:11:20,
putin 's goons are still busy,Holdthebaloney,2017-01-21 03:11:19,
"En fín, a mi me vale barriladas de verga EUA, siempre y cuándo Vladímir Putin siga al frente de mi natal Rusia todo estará bien para mi.",Keniick48,2017-01-21 03:11:17,
"Vladmir Putin , Khan of Russia",gordoi,2017-01-21 03:11:15,
Los que escuchan Mambi están soñando. Trump vende sus productos hechos en China Comunista. El es un traidor. Esperen a Putin,Tom_Fedasz,2017-01-21 03:11:14,
"@PrincessBravato @KatyTurNBC and to think, the Putin wanna be wanted tanks and missiles.",gigispeaksmind,2017-01-21 03:11:12,
"@alexerio @RPPNoticias @realDonaldTrump mientras en @Latina_pe Oxenford llamando ""demente"" a Trump y a Putin . Odio mórbido.",Radalus,2017-01-21 03:11:10,
"Get smart: TITUSHKI expendables work for Putin 's side. Anti Trump protesters are the TARGETS, not the perpetrators. http:// news.sky.com/story/anti-tru mp-protesters-smash-windows-in-tense-scenes-before-inauguration-10735956 …",PaulaBHeinzman,2017-01-21 03:11:09,
@John_Ferrett gets paid by Putin . Opposes EU. Connection?,KevBlower,2017-01-21 03:11:08,
"But Putin intervenes and attacks other countries too, not that different to NATO.",MrNevertheless,2017-01-21 03:11:03,
Kevin McAleer: the Trump- Putin -Clinton-Flatley fake news axis of evil http://www. irishtimes.com/culture/books/ kevin-mcaleer-the-trump-putin-clinton-flatley-fake-news-axis-of-evil-1.2944696#.WIKY8kBp0H0.twitter … via @IrishTimesBooks,GarryDoyle1,2017-01-21 03:10:49,
Putin kills'em. Just saying. https:// twitter.com/melvinlee515/s tatus/822574664291667969 …,oleman2200_josh,2017-01-21 03:10:49,
"so it's so feeble now it makes you angry, uh? Let's talk about Putin . That might make you happy",kazadipapa,2017-01-21 03:10:49,
"as soon as he is given, or makes, the excuse. I don't doubt Bannon has a plan. But when does Putin invade the Baltics?",memnosoncos,2017-01-21 03:10:46,
ni a mi...el amiguito de Putin ...los rojo se apoderan del mundo,ruastur,2017-01-21 03:10:45,
Una testigo de Jehová compró en mi local y se puso a predicar sobre el apóstol Pablo y predijo el fin del mundo junto a Trump y Putin,MagaFreue,2017-01-21 03:10:44,
"Speaking of which, Bob Kraft might've gotten debo'd by Putin for his SB ring",DrameTV2,2017-01-21 03:10:44,
Colbert: Trump and Putin are gonna flip a coin to see who gets to invade Denmark... #dkpol https://www. youtube.com/watch?v=wKZSm2 kecnA&sns=tw …,me_marco,2017-01-21 03:10:33,
ended badly for scar. Will end badly for Putin 's Orange plaything,AlexeiBayer,2017-01-21 03:10:26,
It was hard to understand Donald Trump's inaugural address with Putin 's dick in his mouth,Peugh,2017-01-21 03:10:19,
#Trump 's 1st acts as 'President:' Purging pages on #LGBT & Climate Change from http:// WH.gov website #Putin #Russia,DaTwilightZone,2017-01-21 03:10:07,
Wonder if Putin is coming to WH for a PJ party tonight.,KimDHello,2017-01-21 03:09:53,
@DarkMonster006 T un putin de gros chatteux gg,AlexyDema,2017-01-21 03:09:52,
Es putin jajajajajajaajajajajja,DavidMonteneg02,2017-01-21 03:09:51,
"If Obama was nicer to Putin ,the hacker would've been unnecessary.",notlob2,2017-01-21 03:09:47,
"@asJBdorightthng Putin fed Russians same propaganda,I'm sure",spunkygaga,2017-01-21 03:09:43,
Putin 's gonna eat trump alive.,athrealist,2017-01-21 03:09:40,
@conservatyler Putin again!!!,BeansBagwell,2017-01-21 03:09:39,
nope it is a travesty and a national horror that you owe to Putin,psychokitty78,2017-01-21 03:09:37,
"Dan Rooney = U.S ambassador to Ireland, Robert Kraft gave a superbowl ring to Putin and backdoored the Pats off a Motown lovin Irish family. pic.twitter.com/FQAsjAoQsO",TreyDunna,2017-01-21 03:09:36,
"Will someone photoshop Putin 's cock onto this please, I'm so tired. pic.twitter.com/7vR0i9Fi5U",chelseagirl2,2017-01-21 03:09:36,
"You've got it backward, @ericgarland : Trump is on Putin 's staff.",brandonrgates,2017-01-21 03:09:32,
Looks like he's guzzling Putin 's jizz. https:// twitter.com/SscottSsmith84 /status/822573487206371329 …,jooblee,2017-01-21 03:09:27,
@RMCsport @TeamOM_Officiel @lephoceen putin tout ca pour faire du buzz bande de pute vous faites pitié,cusidu13,2017-01-21 03:09:24,
help from his buddy Putin is why he got elected,AmericanCFLFan,2017-01-21 03:09:20,
"#notmypresident Prostitutes, Hidden Hotel Camera's: Familiar Putin Tools | Rachel Maddo... https:// youtu.be/uHX031UoCXA via @YouTube",gooroo777,2017-01-21 03:09:16,
Wouldn't it be ironic if Putin paid for this?,tripletangels3,2017-01-21 03:09:15,
#RussiaHacking Conclusive proof Putin did it. pic.twitter.com/kC2YUHCxwR,tonyblunt12,2017-01-21 03:09:13,
didn't you mean to send that Putin ?,sumner_camille,2017-01-21 03:09:12,
"Says Russian citizen @sseagalofficial @realDonaldTrump Steven Seagal Is Now A Citizen Of Russia, Courtesy Of Putin https:// n.pr/2eYOxQu",bart_sheriff,2017-01-21 03:09:05,
"Wow, nobody attended your inauguration what happened to all those so called voters? Oh I 4got, Putin elected you.",MorganLassiter5,2017-01-21 03:09:04,
Putin the new President of the United States thanks to tRump pic.twitter.com/7tYpDyYmH1,tpradia,2017-01-21 03:08:59,
#Putin kicking himself for not arranging bigger crowds. #Inauguration pic.twitter.com/9tsdigeMSZ,eng_cam_noel,2017-01-21 03:08:55,
#Putin has said hed use asymmetric #war . Is this it?! #Revolution,lucyk6992,2017-01-21 03:08:54,
"Listening to Putin , Part I http:// bit.ly/2jEYZ1N",MRPhats11,2017-01-21 03:08:48,
""" Putin 's workrate and industry in the middle of the park was essential to the result""",CMorpurgo,2017-01-21 03:08:46,
"Yeah but you never know when you might slip and land on a radioactive isotope, like Alexander Litvinenko did after criticizing Putin . https:// twitter.com/wikileaks/stat us/820021862931591168 …",iron_charioteer,2017-01-21 03:08:46,
Putin ? https:// twitter.com/ericgarland/st atus/822580657448775681 …,ImdeKat,2017-01-21 03:08:43,
. @MikeWiseguy speaks to a demonstrator cosplaying as Putin while protesting the #Inauguration pic.twitter.com/PkoDid7px1,TheUndefeated,2017-01-21 03:08:42,
コルホーズリーチ！！！,Putin_m_bot,2017-01-21 03:08:41,
I've talked to Finns who are afraid of a next Molotov-Ribbentrop Pact being secretly signed by loud coward Donny and V. Putin,fluffyhuggenstn,2017-01-21 03:08:40,
By saying NATO is obsolete and bending over for Putin ?,easy5050,2017-01-21 03:08:39,
"Donald Trump y Vladimir Putin , los nuevos Rubius y Mangel",Donystifler,2017-01-21 03:08:38,
"I get drawing a direct connection btwn the two, but some of these Trump/ Putin signs are homophobic af tbh #fucktrump #butnotliterally",ErichHaygun,2017-01-21 03:08:35,
Trump şi Putin : secretele unui cuplu infernal: RFI:Ultimul număr al revistei franceze L’Obs publică un lung dosar… https:// goo.gl/fb/D80NL1,etdbrief_ro_1,2017-01-21 03:08:27,
Putin is smart - he will turn US vs China quick via his puppet (Trump). A weak America is good for Putin,Chuck090672,2017-01-21 03:08:26,
Putin : Obama is the whore that wont leave https:// youtu.be/gkuPaO1H7ek via @YouTube,cdoddsorourke,2017-01-21 03:08:21,
"When You Want to Exonerate Your Network for Trump, Cry Putin ! https:// twitter.com/jaketapper/sta tus/822261819003772929 …",J_K_Smothers,2017-01-21 03:08:20,
Europa y la constelación Trump- Putin | Europa | http:// DW.COM | 20.01.2017 http://www. dw.com/es/europa-y-la -constelaci%C3%B3n-trump-putin/a-37216812 …,nanreh93,2017-01-21 03:08:18,
So this makes Putin Palpatine? https:// twitter.com/iamsizzlebutt/ status/822576228297244673 …,Kosherart,2017-01-21 03:08:15,
Pretty sure Trump's secret service code name is Putin . #hellhasfrozenover #resist #impeachhimnow,sfredrickson1,2017-01-21 03:08:11,
Donald trump and putin can tongue kiss now,getrichordi,2017-01-21 03:08:11,
Putin e l'America che brucia https:// twitter.com/RT_com/status/ 822579835990110209 …,riotta,2017-01-21 03:08:11,
or it could be the look of oh shit now I am really Putin 's bitch. And I'm going to have to put out.,frannie1225,2017-01-21 03:08:10,
Trump's Inauguration Fireworks Seem To Have Paid Tribute To BFF Vladimir Putin ! http:// gossipbucket.com/perez-hilton/1 098221/trumps-inauguration-fireworks-seem-to-have-paid-tribute-to-bff-vladimir-putin/?utm_source=dlvr.it&utm_medium=twitter … #PerezHilton #1098221 #1,CelebTechNews,2017-01-21 03:08:09,
"I wanted say with Putin , but i recalled that Putin is Batman and... damn, it was a secret of Russia... i need go...",MaxmygoB_Xu3pu,2017-01-21 03:08:06,
El mundo bio como se derrumbo EU ante el poderio Ruso en siria q viva el ejercito Ruso q viva putin,joseganzalez09,2017-01-21 03:07:55,
"Next, Putin moves in and ""bunks"" with you and Ivanka. Hustler will have their tape then!",ScionOfTiamat,2017-01-21 03:07:55,
"I agree. Compared to great leaders like Putin or Boumediene, he is disappointing.",GnChNr,2017-01-21 03:07:52,
We Need the Truth About Trump's Relationship with Putin Now http:// feeds.feedblitz.com/~/260478718/0/ alternet …,Sisantanao,2017-01-21 03:07:48,
A new regional order in the Middle East? Trump to team up with Assad & Putin in Syria? Beginning of the end of the Syrian conflict? pic.twitter.com/AJTD3vC6fI,syrian_law,2017-01-21 03:07:44,
"Trump.Tories, Putin ,Brexit-the far/right are in control now-can't moan and blame the liberals/EU anymore should you mess up",_Jasmine___1,2017-01-21 03:07:42,
bien tiene puesto el apellido le falta hijo de putin .,IsabelDeSimone1,2017-01-21 03:07:41,
"Too bad you have to be a billionaire to be one of those people, isn't that right Comrade Trump. Ask Putin he'll tell you.",whynot9889,2017-01-21 03:07:40,
u have no room to talk. U voted for a putin loving loon Jill Stein. How is ur protest vote working out for u?,wesleynyc,2017-01-21 03:07:39,
Putin de première game sur R6 on est bien with/ @Neoo_EU pic.twitter.com/obmRvOWRhB,TwixoXtrem,2017-01-21 03:07:36,
and putin for prez,Demo201811,2017-01-21 03:07:36,
Trump's Inauguration Fireworks Seem To Have Paid Tribute To BFF Vladimir Putin ! http:// dlvr.it/N97D7G,Google_My_Boobx,2017-01-21 03:07:35,
Trump's Inauguration Fireworks Seem To Have Paid Tribute To BFF Vladimir Putin ! http:// dlvr.it/N97D2v,bokuranoashiato,2017-01-21 03:07:35,
Trump's Inauguration Fireworks Seem To Have Paid Tribute To BFF Vladimir Putin ! http:// perezhilton.com/2017-01-20-don ald-trump-inauguration-fireworks-usr-russia-hacked-vladimir-putin?utm_source=dlvr.it&utm_medium=twitter …,CelebTechNews,2017-01-21 03:07:34,
Trump's Inauguration Fireworks Seem To Have Paid Tribute To BFF Vladimir Putin ! http:// perezhilton.com/2017-01-20-don ald-trump-inauguration-fireworks-usr-russia-hacked-vladimir-putin?utm_source=dlvr.it&utm_medium=twitter … #people,News_Gossi_p,2017-01-21 03:07:34,
Trump's Inauguration Fireworks Seem To Have Paid Tribute To BFF Vladimir Putin ! http:// dlvr.it/N97D66,kigsjc,2017-01-21 03:07:34,
Vladimir Putin accuses Malcolm Turnbull of being soft on ISIS http:// dailym.ai/2c8IUei,oranglaut,2017-01-21 03:07:30,
psst U'r right Mustve been Putin afraid Bernie'd start WWIII & refuse to sell more UR b/c BERNIE WOULD HAVE WON @ActualFlatticus @Ellahbie https:// twitter.com/mikeyoranje88/ status/822505428592525313 …,rabbeni_kim,2017-01-21 03:07:14,
"They had no choice. Trump made them do it. I mean Putin . Wait? OK, now I'm confused...",MarkSleboda1,2017-01-21 03:07:11,
WH Petition to Congress: Investigate Trump's ties to Putin https:// wh.gov/iuinR We are NOT letting this drop.,MelMall,2017-01-21 03:07:08,
"So thr u hv it. Director of the #FBI ,who didnt inform the ppl Russia ws helping Trump,ws also hlping Putin & Trump, due to hate of Clintons https:// twitter.com/RVAwonk/status /821880452428496896 …",solaranoir,2017-01-21 03:07:05,
Gobierno de Venezuela otorga premio de paz a Vladimir Putin http://www. elnuevoherald.com/noticias/mundo /america-latina/venezuela-es/article127296164.html …,dionisio_fdez,2017-01-21 03:07:05,
Putin es el nuevo Zar Real de Rusia Después de la Muerte del Último Romanov http:// ln.is/www.youtube.co m/L5KYP … vía @YouTube Puedo usted creerlo ?,migomez42Gomez,2017-01-21 03:07:04,
Vladimir Putin,corey_ebooks,2017-01-21 03:06:58,
"This coming May, Pres. Duterte will make a historic visit to Moscow as a guest of Pres. Putin : http://www. thevolatilian.com/bear-facts-lai d-bare/ … #philippines #Duterte",TheVolatilian,2017-01-21 03:06:57,
Putin and Trump secret meeting(Enquirer),lewis_dr,2017-01-21 03:06:53,
De todas formas yo creo que Obama aplastaba Ucrania antes de Putin . http://www. abc.es/internacional/ 20140414/rc-confirma-director-visitado-ucrania-201404142045.html …,tomaspawlo,2017-01-21 03:06:52,
"I think we had a great nominee. I think she ran into a perfect storm of assholes. Comey, Putin , and MSM all fucked her.",Qstache2,2017-01-21 03:06:52,
Republicans Tom Cotton and Joni Ernst say Vladimir Putin is not our friend http:// ln.is/www.rawstory.c om/201/13Cf6 …,bmangh,2017-01-21 03:06:48,
"AND OF COURSE, premier PUTIN !",SinCityChrisS1,2017-01-21 03:06:44,
Asi comienza ¡ compagina con la política de Putin ... para él un cachetazo al año no es violencia ... https:// twitter.com/Hibai_/status/ 822536021116076035 …,lacorderoes,2017-01-21 03:06:43,
"Obama Facing Possible Prosecution, Officials Demand Proof Of His Claim About Trump And Putin http:// putin.trendolizer.com/2017/01/obama- facing-possible-prosecution-officials-demand-proof-of-his-claim-about-trump-and-putin.html … via @Putinizer",buddendorf,2017-01-21 03:06:41,
Weirdly close to Putin hmm I say spy lol,Darth_Daisy,2017-01-21 03:06:38,
"/ I? Yes, Russia. Good people the Russians. Good, strong, big, mean, sexual people. Great leader. Putin , he's real a hero of mine. Me. /",meatballwizard,2017-01-21 03:06:07,
Low attendance and worse ratings than the apprentice. That's gotta hurt #Putin 'spuppet,caxacho,2017-01-21 03:06:06,
"Flexible objective, broad a SNOWDEN! Calls Russians Putin enter area! The DC/MD/VA!",ericgarlandbot,2017-01-21 03:06:04,
Putin can never measure up so he'll try to bring us down instead. https:// twitter.com/sovietsergey/s tatus/822540810516332544 …,dima7b_,2017-01-21 03:06:01,
bir tarafta REIS bir tarafta putin bir tarafta tramp kiliclar yeniden cekilecek güzel mac olacak DIK DURUN ZAFER BIZIM OLACAK !!,_osmanli_1453_,2017-01-21 03:05:57,
"a war monger vs an incompetent uneducated manbaby, who is afraid of putin ?hmmm, not a tough choice gimmie the chick with balls",HillyesRose,2017-01-21 03:05:54,
@MrsBrittSim welcome to Twitter pillow biter for Putin .....you scumbags with these fresh accounts,RussellsPal,2017-01-21 03:05:51,
"ITALIA SOTTO LA NEVE, COSÌ PUTIN CI OFFRE SOCCORSO: “PRONTO AD INVIARE UNA TASK-FORCE DI PROFESSIONISTI” http:// fb.me/a6l6Fm40C",thomaslicc,2017-01-21 03:05:51,
"Strange: Putin 's basic justification reason for intervening in Ukraine is the ""neo-nazis"" who allegedly ousted Yanukovych.",sTeamTraen,2017-01-21 03:05:48,
Trump could have taken Putin 's advice about hiring masses of people to line the parade route. Would have made it less sad.,TroyMinos,2017-01-21 03:05:47,
". @RyanSprung I'll be sure to see Trump as an example of class & patriotism: praising Putin , mocking the disabled, pussy grabbing commentary",heykristance,2017-01-21 03:05:44,
"Mr. President, all I ask of you is that when it comes to Putin , that he longs for the days when he sat with his father and Papa Joe",IslandoffDevon,2017-01-21 03:05:42,
President Donald J Trump will undo theGood Work done by Obama &will then blame Obama in times of Crisis while he works4 Putin #Inauguration,Muskaan016,2017-01-21 03:05:37,
"Nice column. Is ""Trump- Putin administration"" intentional sarcasm or a Freudian slip? Quite apt either way.",ParryRacer,2017-01-21 03:05:36,
Don $ Rajoy EPN Tromp Holande Merkel Putin Macri pic.twitter.com/KYm7awi6sp,SalvadorDelRio9,2017-01-21 03:05:34,
Don $ Rajoy EPN Tromp Holande Merkel Putin Macri pic.twitter.com/vMBdU8jV3Q,SalvadorDelRio9,2017-01-21 03:05:34,
America nord - Trump America sud - chavismo Europa - Grillo Farage Podemos Populisti Asia - Putin isis Korea La globalizzazione dell'incubo!,Kalotipia,2017-01-21 03:05:32,
"Nooo, tas loco?!. Gano Putin .",leandrobagna,2017-01-21 03:05:30,
La fin des Radicaux islamistes assassins organisée par Trump et Putin crevera les muz de France qui se terrerons ! https:// twitter.com/RachelSabin/st atus/822447415894675457 …,ROSEDAVID0008,2017-01-21 03:05:30,
...because you don't trust the IRS to catch any cheating or you're looking for that money from Putin ?,scru_m,2017-01-21 03:05:26,
@agapanthus49 thought he was goven russian citizenship by Putin last year ?,steve66myers,2017-01-21 03:05:20,
you mean like the ones promising armed insurrection if trump lost? Putin ordered Trump to make the US retreat @colleencpa,MJoyce2244,2017-01-21 03:05:18,
"I wonder if PUTIN is cleaning out Lenins tomb to bury Trump in, when or if he's assasinated, after all he bought him the presidency",Dr_H_Biote,2017-01-21 03:05:18,
putin et moi je travaille encore mes lancers,VinsanityShaq,2017-01-21 03:05:14,
"Ahora nos encomendaremos todos a ""malvado"" Putin , que hace unas horas era nuestra bestia negra. Bochornoso https:// twitter.com/SimancasRafael /status/822494875329380353 …",Jordi_Aguilo,2017-01-21 03:05:13,
"No wonder he loves the uneducated. He's giving Goldman-Sachs, Exxon all your money, and Putin American money. You're a traitor.",AS307,2017-01-21 03:05:04,
And now Putin has our nuclear codes... https:// twitter.com/himaui/status/ 822579508054282240 …,10fifteen,2017-01-21 03:05:02,
