"Los anarquistas comunachos de Facebook que creen que Trump va a ser mejor que Obama porque es amigo de Putin me dan tanta, pero tanta risa.",Mitsumei,2017-01-21 01:54:17,
"@cnn @FoxNews @NBCNews Stop spinning & repeating known lies about President Trump & Putin , Russia & election. #PresidentialInauguration",MissLiberty1776,2017-01-21 01:54:14,
How many times will Vladimir Putin throw his penis down Trumps bulbous mouth? @skyhorsepub @RogerJStoneJr @realDonaldTrump #tytlive,Mort_Magirt,2017-01-21 01:54:13,
"That's what Putin 's folks did back in Ukraine. Not saying it is them, but surely the methods are similar.",noisykid81,2017-01-21 01:54:11,
SHE is #ThePeoplesPresident and you are a meaningless tic attached to the foot of Putin & deposited on his puppet's ass.,TAW3343,2017-01-21 01:54:09,
"@therealroseanne Here is where Putin can be an Ally: in talks with Obama, Putin said, ""I'll bomb the B*ST*RDS back to Hell!""",DavidSmith5454,2017-01-21 01:54:03,
Especially ' Putin funded'!,yackheather,2017-01-21 01:53:59,
It’s clear that Trump’s administration is trying to send America back to the Dark Ages at Putin ’s behest. This is sad. Progress up in smoke!,BlkCarmenSDiego,2017-01-21 01:53:59,
"I should be surprised, but some people are so stupid, they claim that Putin was behind Trump's election. It was... http:// fb.me/2V01fMHwh",PiltdownSupermn,2017-01-21 01:53:59,
"@pmitch69 Yeah, apart from Putin .",waxlyrical29,2017-01-21 01:53:54,
Amazing how few Americans familiar w/ post-WW2 history of ( Putin -approved) #AmericaFirst slogan. We need 2 beef up education BIGLY!,LittleDsrtFlowr,2017-01-21 01:53:53,
Ahora el pato de Disney tiene apellido. Trumph. Ese hijo de Putin no quiere nada con Latinoamerica será x Alicia Machado. Celos. Esperemos,WilmerR19976991,2017-01-21 01:53:53,
Trump’s Angry Red Tie: The Politics of Inauguration Fashion http:// thebea.st/2jWhD2Z via @thedailybeast Signal to #putin ? (-:,ArthurCaplan,2017-01-21 01:53:52,
PUTIN won,BaittyJulie,2017-01-21 01:53:46,
Dump won't last. GOP always hated him; they're already building a case against him & Putin . Pence is one of them.,coy325ic,2017-01-21 01:53:45,
What is happening? Why is Sheldon Adelson everywhere? Is he sharing custody of Trump and the U.S. executive branch with Putin ? #Awkward,Nov32020fan,2017-01-21 01:53:41,
@RT_America where's Putin in the back?,boston_daryl,2017-01-21 01:53:37,
He spineless d@ck sucking a@s won't do that he is putin 's other b@tch https:// twitter.com/straussanator/ status/822542279491682306 …,teamkimlisa,2017-01-21 01:53:35,
Nah -- we are drunk and sad that Putin is going to revive the USSR. THAT's all.,RebeccazWriting,2017-01-21 01:53:35,
Putin creo que va a ser su mejor aliado.,PedroBDonoso,2017-01-21 01:53:27,
Putin również wiąże wielkie nadzieje.,leon_lewy,2017-01-21 01:53:23,
Who knew that #Trump supporters (real and paid) are even worse trolls than the (paid and unpaid) #Putin trolls? Go figure.,GicAriana,2017-01-21 01:53:19,
"It feels good to know his support is so limited. Remember, he only won because of a glitch in the system.... Putin 's interference. https:// twitter.com/CaptainsLog201 7/status/822532538400964608 …",Just_Tjaye,2017-01-21 01:53:16,
"Wie Pan, ja się raczej nigdy nie pomyliłem, ani o Janukowyczu, ani o Asadzie i Syrii. Mówiłem, uprzedzałem, że Putin usypia.",RussianClimates,2017-01-21 01:53:14,
Достоин уважения! Надеюсь наши надежды оправдаются.),olimpiada8067,2017-01-21 01:53:13,
Trump- Putin : un idilio con altibajos entre los dueños del arma nuclear @El_Plural http://www. multiforo.eu/PORTADA.htm,caval100,2017-01-21 01:53:10,
Trump Investigated By 6 Intel Agencies For Payments From Putin http:// addictinginfo.org/2017/01/18/bom bshell-trump-is-being-investigated-by-six-intelligence-agencies-for-illegal-cash-payments-from-putin/ … #trumpinauguration #InaugurationDay #Inauguration,tAsarlai,2017-01-21 01:53:09,
@AndreaChalupa The Fraud and cheat Donal Trump arrived at the house that was secured by Putin .,paramikids_moo,2017-01-21 01:53:07,
@realdonaldtrump @NBCNews if trump wasn't conversing w/ Putin we would of been at war over pussy you the press have been covering for 8yrs,AJOKERONJACK,2017-01-21 01:53:07,
Wait...you mean buy American sell to Putin .,JRBanTwittler,2017-01-21 01:53:04,
Trump VS Putin https:// youtu.be/R8VwdXxs8wc с помощью @YouTube,SergeyKokoteev,2017-01-21 01:53:02,
"Le Pen, Le Putin - opinion too but facts are right https://www. bloomberg.com/view/articles/ 2017-01-05/le-pen-shouldn-t-count-on-putin-s-money …",asH9C,2017-01-21 01:52:59,
Hans supporters kommer känna den värsta[mentala] 'baksmällan' #HangoverOfaLifetime 2 @realDonaldTrump listen 2 your IC(not #Putin ) #FFS https:// twitter.com/stridskatt90/s tatus/822555752552349696 …,PeterSan8,2017-01-21 01:52:53,
demain ma sœur elle a le bac blanc putin un samedi matin mdrr,PootinooBenArfa,2017-01-21 01:52:51,
Frage an Radio Eriwan Stimmt es daß Präsident @realDonaldTrump wie angekündigt schon die US-Atomcodes an Präsident @Putin _V_V übergeben hat?,TnnMagazine,2017-01-21 01:52:50,
How does Vladimir Putin 's penis taste? @RogerJStoneJr @realDonaldTrump,Mort_Magirt,2017-01-21 01:52:50,
All hail the Vulgarian in Chief @realDonaldTrump . I'm sure this is a proud day for Vladimir Putin .,Brklygrad,2017-01-21 01:52:49,
"Austrian far right signs deal with Putin 's party, touts Trump ties http:// ln.is/qK6EP by #SLATUKIP via @c0nvey",Alan_Moran,2017-01-21 01:52:47,
"sorry for PUTIN u on the spot, but you lost, buddy. Wishing you peace of mind for whatever caused such hate in you.",alectron3000,2017-01-21 01:52:47,
TrumPutisme. Trump og Putin udfordrer EU - http://www. teddyomolly.dk/trumputisme-tr ump-og-putin-udfordrer-eu/Trumps … udenrigspolitik er ret så forudsigelig. Det er kombinationen af Trump ...,TeddyoMollyDK,2017-01-21 01:52:43,
We had an election and the only vote that counted was Putin 's.,pmstillman,2017-01-21 01:52:41,
We are now the second largest domain in Vladimir Putin 's empire.,DavidRedstone2,2017-01-21 01:52:39,
"Nah, just don't like trumpniks very much. Then again, you do look like future Putin employees.",hccpal,2017-01-21 01:52:37,
"Trump intentará un acercamiento con Rusia para hacer un Bloque contra China,el estratega Putin entrará en el juego? Ya veremos.",irisdioci,2017-01-21 01:52:28,
Trump & putin using the nazism of germany but not the country is the first beast. pic.twitter.com/8O9Qmkr6Dx,RayHuber69,2017-01-21 01:52:24,
When is Putin being sworn in as VP for the trollz? #Inauguration,theNewsfox,2017-01-21 01:52:23,
"No one condones violent protesting. It makes everyone look bad, but not NEARLY as bad as having #Putin get you elected #Impeachtrump",PWRoTCH,2017-01-21 01:52:22,
Leader of far right Austria party )who Reuter's stated has agreed to be go between for Putin & Trump) tweets he was at Inauguration...,snarkytoes,2017-01-21 01:52:20,
"Trump’s ""bromance"" with Putin poses a major risk for U.S. corporations: http:// on.mktw.net/2jdmqMQ pic.twitter.com/GZOalNH5ev",GIRSllc,2017-01-21 01:52:16,
@TheDemCoalition Moldovan Pres Dudon was at Moscow press conference where Putin defended Trump. Dudon wants to withdraw from EU,DishMurphy,2017-01-21 01:52:12,
"60,000 people in 3 states, Comey and Putin elected Donald. #PopularVote",RebeccazWriting,2017-01-21 01:52:09,
One Trump supporter suggested Putin could get a cabinet post. http:// m.motherjones.com/politics/2017/ 01/trump-inauguration-voters-putin-obamacare-video …,LinaMonroy01,2017-01-21 01:52:07,
"Trump’s ""bromance"" with Putin poses a major risk for U.S. corporations: http:// on.mktw.net/2jdmqMQ pic.twitter.com/wkU6eR50Rd",MarketWatch,2017-01-21 01:52:07,
Trump ist da wenn er Rammstein verkauft ist alles leise. Hoffentlich kauft es Putin .,witchilie,2017-01-21 01:52:06,
"A general message I'm sure he would understand. With love from Russki.Tbl chlen kiska i obshchiy pedik. Translate that with Putin , faggot. pic.twitter.com/mpZbVXrbpk",PrimaryJennifer,2017-01-21 01:52:06,
"We had an election and the only vote that counted was @PutinRF_Eng Putin 's. Many conservatives are concerned, too",pmstillman,2017-01-21 01:52:05,
What Does Vladimir Putin See in Donald Trump? https:// nyti.ms/2k3nHpM,beadbear,2017-01-21 01:52:03,
"Salvando las distancias, para completar la comparación, ¿Talia al Ghul llegaría a ser Putin ? https:// twitter.com/verne/status/8 22553994086285312 …",PolisHumana,2017-01-21 01:52:02,
"retweet, favorite and follow to win used, sneaky processor made by Vladimir Putin ! #winning #rt2win",MSueberg,2017-01-21 01:51:56,
"Putin 's Vice President, #DonaldTrump sworn in. #Inauguration pic.twitter.com/MWfkW1NUgt",CB_Uganda,2017-01-21 01:51:55,
Congratulations to Vladimir Putin --you did it!,Chooglin1,2017-01-21 01:51:47,
@torjus @LarryWildman because Putin is using his #RussianHacking powers to control Trumps mind,chickentraderrr,2017-01-21 01:51:46,
Putin spokesman denies US election hack - BBC News http:// crwd.fr/2iL1TTv pic.twitter.com/27zD8IB7yY,hiphopgrindtv,2017-01-21 01:51:45,
Putin spokesman denies US election hack - BBC News http:// crwd.fr/2j40i9R pic.twitter.com/Cq7ZZUcGxM,HhgtvFitness,2017-01-21 01:51:45,
Great performance--couldn't even see Putin 's hand up his backside.,RubeBait,2017-01-21 01:51:39,
"Wow. Amazing tweet, given how many @nfl owners are rabid boosters of Putin 's puppet. #Inauguration https:// twitter.com/nfl/status/822 187295952355328 …",forbiddencomma,2017-01-21 01:51:38,
"I really hope your faith isn't misplaced, but I think you'll be disappointed. He's a narcissist and a Putin shill.",katherine1975a,2017-01-21 01:51:34,
Didn't Putin take it?,darlydar,2017-01-21 01:51:33,
I wanna see mr. D. Um with Putin shaking hands or im fukkkn dead. Now save my ass. #stanley,JanIlluminati,2017-01-21 01:51:32,
Not sure if this is true. But Vladimr Putin is said to call Trump. Comrade Trump? https:// twitter.com/dianehain/stat us/822561152119017472 …,stox515,2017-01-21 01:51:30,
"Austrian far right signs deal with Putin 's party, touts Trump ties http:// reut.rs/2hiQUfa via @Reuters . @20committee",debmorello,2017-01-21 01:51:26,
"Don't worry Larry. The American ""Civil Society"" is only making America great again. Putin Owns The United States !!!!];-) @kingsthings",Moeedi,2017-01-21 01:51:22,
"Tonight""s party at the White House is going to be yuge! Like nothing this country has ever seen. We will be #Putin on the Ritz. #GOP #POTUS",RealOrangePOTUS,2017-01-21 01:51:22,
"If you're really in Poland, don't call for help when #Putin comes visiting. Donnie won't care.",ictcowgrrl,2017-01-21 01:51:21,
"you're giving "" putin "" too much credit, and trying to ignore the *people* choosing what u don't like.",babadooky,2017-01-21 01:51:17,
Putin de lycée qui me met langue des signes sur Apb et pas de Dnl ...,Nicos631,2017-01-21 01:51:17,
Vladimir Putin defends Donald Trump and throws in a unique pitch... pic.twitter.com/IopPsuitUb,SmileFunXXL,2017-01-21 01:51:10,
Mexicanos piden ayuda de Putin para eliminar su ‘mal Gobierno’ http:// dlvr.it/N967Hc pic.twitter.com/0ETvOfYhni,InsManquehue,2017-01-21 01:51:09,
@mimi_ putin RTありがとうございます フォローさせていただきました,Ohmiya__Karen,2017-01-21 01:51:06,
Vladimir Putin addresses Trump’s rumored golden showers with Russian... http:// ln.is/X8F2z by #IsabellaWills via @c0nvey,lilar_castro,2017-01-21 01:51:06,
"Boycotting along with all who are disgusted with Trump's views on women's rights, climate & Putin love.",ronalda706,2017-01-21 01:51:04,
"Congratulations to President Putin . And congrats to his small handed puppet, trump.",MrPepePants,2017-01-21 01:51:04,
Putin has not gotten back to me regarding his support of unregulated and heavily armed citizens in the USA. Does Russia have that policy?,freerange1,2017-01-21 01:51:03,
"Putin now runs two countries, first time in history Making Russia Bigger again",MHolmesjr1978,2017-01-21 01:50:59,
"Jeg ser på Obama og Clinton som krigshissige psykopater. Jeg har veldig tro på Putin , håper Trump klarer å alliere seg med han.",ArneSeland,2017-01-21 01:50:55,
Now go write more shirtless Putin skits that'll scintillate the comedy world like a wet blanket https:// twitter.com/katiemaryrich/ status/822520933625761792 …,anangbhai,2017-01-21 01:50:54,
#resistance #Indivisible #opTrump #StrongerTogether #Moscowtimes #Tass #Sputnik #Russia #putin https:// twitter.com/markberman/sta tus/822532640175689728 …,972_834,2017-01-21 01:50:50,
"Brasileiro elogiando Trump porque seria ""contra a esquerda"" é o mesmo que vibra com Putin porque é russo e ""contra os americano"".",AndreArruda,2017-01-21 01:50:50,
"let me putin this in terms you'll understand.Russia,golden showers, prostitutes as young as 16. U getting it Yet ?",gmbbrwells,2017-01-21 01:50:46,
Now that the RepubliNuts are in place they'll shiv Putin 's puppet. GOP'll impeach his traitorous ass so quick.,coy325ic,2017-01-21 01:50:29,
"Hopefully not long, before he gives all our Intel to Putin https:// twitter.com/rmasher2/statu s/822561319220080640 …",DebbieGrandoni,2017-01-21 01:50:28,
USA: spadł kurs dolara; inwestorzy obawiają się protekcjonizmu Trumpa. Putin zły RUB Kaczyński Zły PLN terazTrumpa zły USD,modliszka30,2017-01-21 01:50:26,
Putin makes troll coal got to give it to him he's creative #IMPEACHTRUMP https:// twitter.com/christogrozev/ status/822466988505264128 …,micfuckabee,2017-01-21 01:50:24,
@TheWhiteHouse IT ISN'T THE DESTITUTE (Déclin) WHILE BUSH GET IN COINS McCAIN SPECULATE TRUMP PUTIN FIGURATE SUPER PUISSANCE (COLDER),COSMOBOL3,2017-01-21 01:50:23,
@realDonaldTrump You should meet with Putin next Friday and bring back in those removed Russian Diplomats. after declaring China #moneymanip,Blighted_Ashes,2017-01-21 01:50:20,
TIME IS NOW! WORK HARD 2 PURGE @GOP AFAIK GOV OF PUTIN STARTING 2018 RYAN/BITCH MCCONNELL/ORRIN HATCH/GARDNER OF COLO UP 4 RE-ELECTION! https:// twitter.com/DrKysela/statu s/822550559551094784 …,MargaretSchafe3,2017-01-21 01:50:16,
"Influencer #Marketing Campaigns: So Powerful, Even Putin Is Using Them! http:// ow.ly/wwom308azQW via @DG_Report",100indecisions,2017-01-21 01:50:15,
"No OK, wrzeszczę tu ostatnio, że Putin się domyślił, że USA da się ignorować. Nie wiem czy w PL ktoś coś w związku z tym?",RussianClimates,2017-01-21 01:50:15,
Quieren Ah Vladimir Putin En Latino America/Para Acabar Con Lo Que Sucede En Mexico/Suscibete: http:// youtu.be/NJ_q3MohxbQ?a via @YouTube,bryanslugo,2017-01-21 01:50:11,
"Kraft gave Vladimir Putin his NE Patriots Super Bowl ring but like, naw, that's not sketchy at all... https:// twitter.com/vicesports/sta tus/822488665502994432 …",twocrazybunnies,2017-01-21 01:50:11,
Regan & Gorbachow '86 Trump &a mp; Putin 2017,MusliZuka,2017-01-21 01:50:06,
Putin Blows Off #Trump #Inauguration for #Russian Ice-Swimming: https:// themoscowtimes.com/news/putin-blo ws-off-trump-inauguration-for-traditional-russian-ice-swimming-56878 … (Eng) #Epiphany,RussRLGNWatch,2017-01-21 01:50:02,
la derniere fois en voiture ya un putin de connard qui a voulu sengager en me doublant par la droite pck jmettais du tps a mengager,bokuthoe,2017-01-21 01:49:59,
2 things come to mind: 1) Trump's WWF days 2) Putin |Trump Wanted Soviet Style Inaugural Parade w/ Tanks & Missiles http:// talkingpointsmemo.com/edblog/trump-w anted-soviet-style-inaugural-parade …,noahtoly,2017-01-21 01:49:59,
Then hear me. Disclose your tax records. Divest of your business. Shut down Putin . You lost popular vote by 2.5M votes.,UnderCat_ishere,2017-01-21 01:49:54,
"TRANSLATION: @SpeakerRyan Here's to us helping @mike_pence , Putin and the Oligarchs fleece the American public #tcot https:// twitter.com/SpeakerRyan/st atus/822535393585364993 …",iammeetoo,2017-01-21 01:49:54,
RELEASE YOUR TAX RETURNS FELLOW AMERICAN. Coward. Putin 's puppet. Waiting for your impeachment..Popcorn on standby.,dhb829,2017-01-21 01:49:53,
ojito que miembros de su administración ya le han avisado que cuidado con Putin,Borja_Lavado,2017-01-21 01:49:52,
"Putin said it was, so Republicans responded...",Henke2020,2017-01-21 01:49:52,
"Let's all congratulate the new leader of the world, Vladimir Putin . #painting #art #artwork … https://www. instagram.com/p/BPgHqCnA8F3/",seanpgreenberg,2017-01-21 01:49:47,
"And ISIS, Putin , Assad, etc. If they say nice things to me... I'm putty in their hands. https:// twitter.com/mskristinawong /status/822522739395153920 …",BLOTUS45,2017-01-21 01:49:43,
1) What are the 2 countries that Putin wants to strengthen? 2) What are the 8 countries Putin wants to weaken? #Inauguration answer below,AlanaBowker,2017-01-21 01:49:40,
would Vladimir's midget brother be called a 'Little Putin '? You got to be a certain age to get THIS reference..,TimoMajere,2017-01-21 01:49:36,
Guess you like a Putin puppet for President&a commies daughter as FLOTUS!!,devreal,2017-01-21 01:49:30,
Putin 's reaction to #Inauguration of @realDonaldTrump as #POTUS #uspoli #uspolitics #inaug2017 #polqc #cdnpoli pic.twitter.com/6GtjOjX47K,belle_province,2017-01-21 01:49:29,
Security Camera Photo:Flynn giving Putin standing ovation- #Putin paid Flynn & son to be there #trumpleaks ... http:// fb.me/3fN72QKYz,HydeBlizzardbox,2017-01-21 01:49:24,
"Kremlin-friendly activist Maria Katasonova front of a reproduction of an oil painting depicting Putin , Le Pen Trump as ""three world leaders pic.twitter.com/LYkQOyK71K",FenMorgana,2017-01-21 01:49:17,
A guy who wants to emulate Putin & nuke the Middle East. A guy who employs a neo-Nazi as an adviser.,SybilT2,2017-01-21 01:49:16,
Probablemente comparta informacion secreta con Putin y surjan unos cuantos conflictos con Corea del Norte e Iran por cosas nucleares pq si,SashaRK27,2017-01-21 01:49:16,
"I'm belarusian and i hate Putin , silly",Kopacevich,2017-01-21 01:49:10,
"Pennsylvania Ave #Inauguration K Street Have to admit, nothing really says ""Patriot"" quite like kissing Putin 's..... https:// twitter.com/sean_spicier/s tatus/822551700544299008 …",dale967dale,2017-01-21 01:49:04,
Trump wishes he's Putin 's little b**** https:// twitter.com/AntiTrump007/s tatus/822561311603228675 …,s_milissa,2017-01-21 01:49:04,
What time does Putin address the nation?,keethers,2017-01-21 01:49:01,
"infatti ! E quelli contro il NO sono gli stessi contro Brexit, contro Putin , contro Trump, pro €. Non cambiano",mmayr5,2017-01-21 01:48:59,
So are you Trump and Saban is Putin ?,SECNotwork,2017-01-21 01:48:54,
Putin asked about #PMTrudeau threats to put more troops into the Ukraine To keep Russia at bay pic.twitter.com/Bt4IlzPQ8Y,Ottagonia,2017-01-21 01:48:52,
Fuck him--he did almost as much to help elect this as PUTIN did.,JConabicycle,2017-01-21 01:48:52,
"Do you think Melania looking forward to a""pussy grab"" by Putin ? And is Nige famous enough now to have a go as well? #TrumpInauguration",ProUdin2016,2017-01-21 01:48:50,
"Putin recibirá el Premio Hugo Chávez a la Paz y Soberanía Maduro: ""Desde Venezuela reconocemos a Putin como un... http:// fb.me/YoUi4yVh",aitor24584,2017-01-21 01:48:46,
.. Really? And the American people are still thinking that Putin had nothing to do with the elections? God Help us!,MLagonikos,2017-01-21 01:48:46,
"you're criticizing putin , fine. i'm not here for putin . but that has zero to do with trump's victory",babadooky,2017-01-21 01:48:42,
omg please may this get to the Putin expansion. https:// twitter.com/theMegmcmuffin s/status/822492161002192896 …,NOTLF,2017-01-21 01:48:42,
putin on a des tronches,Margot_ght,2017-01-21 01:48:40,
"Not true, he outsourced that work to a firm in Russia, it came recommended by Putin https:// twitter.com/pourmecoffee/s tatus/822560002246344708 …",Steven_Strauss,2017-01-21 01:48:33,
"Putin has the support of over 80% of the Russian people! Jake, you are spreading fake news!",justinthenicko,2017-01-21 01:48:31,
World Leaders League 1. Lawwell 2.Trump 3. Putin .........,F_mc_1888,2017-01-21 01:48:30,
Security Camera Photo:Flynn giving Putin standing ovation- #Putin paid Flynn & son to be there #trumpleaks ... http:// fb.me/2OWPhpIsg,HydeBlizzardbox,2017-01-21 01:48:27,
I have a pair for the Putin Putsch....,michaelsnarky,2017-01-21 01:48:23,
"@tobyvandre PUTIN TOOK AMERICA WITHOUT ONE SHOT ,FASCISM HAS WON OVER DEMOCRACY .",tobyvandre,2017-01-21 01:48:23,
Breaking News. Putin takes control of USA without one drop of blood. @realDonaldTrump #auspol,ListenSport,2017-01-21 01:48:22,
a bug c/o Putin,Bonzarelli1,2017-01-21 01:48:21,
"Putin succeeded, he showed the world that the U.S. isn't so mighty and strong as people once thought smh",bri66rz,2017-01-21 01:48:18,
"that's what I was thinking! He can tag Ryan, McConnell, and Pence along with Fat Boy & Putin along.",TFerrandino,2017-01-21 01:48:16,
Exactly the way Vladimir Putin likes it. https:// twitter.com/eric_wuest/sta tus/822548234572824577 …,OrrChris,2017-01-21 01:48:08,
@realDonaldTrump #NotMyPresident #TheResistance #conflict #Putin @DailyLiberal1 @CNN @LegacyDiner #trump #sasha &masha pic.twitter.com/VblGelpnJF,kaysintBB,2017-01-21 01:48:06,
not to be a pessimist but when that happened to Putin he orchestrated attacks on his own ppl & blamed the Chechens. It worked.,ElishevaAvital,2017-01-21 01:48:06,
"Trump passou a noite a preparar um atentado contra si com a ajuda e experiência de Tayyip Erdogan e Putin , diz Piropos",adasilvao,2017-01-21 01:48:04,
Bent u niet bang voor een pivor ten faveure van Putin door Tillerson?,KipIsLekkerME,2017-01-21 01:47:59,
"For all the hate between them, doesn't it seem as if Putin 's Pet is picking up right where Dubya left off? https:// twitter.com/H_Lev/status/8 22551294229512192 …",FrangibleRocker,2017-01-21 01:47:56,
Podrá ser lo que tú digas pero es el presidente electo de los EEUU y Wladimir putin es su socio y amigo. Punto!,eugeniong,2017-01-21 01:47:55,
Trump is president and Putin is vice president,POTUSYUGE,2017-01-21 01:47:53,
Xi Jinping presidente de China Fidel castro 57 años Cuba Putin Rusia Kim Jong un presidente de Corea del Norte.... http:// fb.me/5LjdN6OcK,JacoboGonzlez,2017-01-21 01:47:44,
but is PUTIN buff enough to face MY UNDERTAKER at SUMMERSLAM?????,PalatzoGamer,2017-01-21 01:47:41,
"""President Trump"" Re-arrange the letters and you get ""Mr. Putin 's Testicles"" or something very close to Mr. Putin 's testicles.",EllenTrailerDog,2017-01-21 01:47:41,
"'If Trump continues to ignore Putin ’s expansionism, Russia will be America’s problem as well as Eastern Europe’s.' https:// twitter.com/foxtrotalpha/s tatus/822517806902218756 …",johnmooreni,2017-01-21 01:47:41,
Надежда умирает последней...,sov2211,2017-01-21 01:47:39,
-desemprego -crise -guerra -défice -tensão racial -crises migratórias -está na mão da China -foi puta do Putin .,MBurglar,2017-01-21 01:47:39,
Russian Fox Fur - Putin paid for them.,FilmProfessor9,2017-01-21 01:47:36,
"disagree, it's Putin . Trump loves Putin . #ComradeTrump",tatt2two,2017-01-21 01:47:35,
*Trump gets a call in the white house* Trump: hello?? Putin : Don't fuck me Trump! pic.twitter.com/ORXKjcQMx6,DatBreezyNice,2017-01-21 01:47:32,
unless he gets impeached soon for corruption & lack of decency. His/campaign collusion w/ Putin /Russian hacking disclosed.,ChoocfantasyM,2017-01-21 01:47:32,
Putin style klepto-fascism is more unAmerican.,jasontraeger,2017-01-21 01:47:30,
@CNNPolitics What happens if it's proven that Trump has had dealings with Putin . Either in a financial way or cahoots way.,AugrEdmonton,2017-01-21 01:47:30,
Putin this on my WALL (I'll just leave) #Inauguration https:// twitter.com/realDonaldTrum p/status/822421390125043713 …,Dongorong,2017-01-21 01:47:27,
Putin is one. Comey is another. Probably the two of them did enough to put him over the top.,MaureenCSmith,2017-01-21 01:47:26,
"guess who trump is friend with? Putin . Only blind can't see, sweet lady. #nufascism",jaquepedia,2017-01-21 01:47:23,
@realDonaldTrump Don't mind If over half the country refuse You and what you stand for. You will never make us bow down to you or Putin . #NO,Luv_shenanigans,2017-01-21 01:47:23,
"Investigate Trump's ethics if you want respect or be a hypocrite. No taxes, no divestment, still prefers Putin . Dr. Suess 1930s US isolation pic.twitter.com/H5mhUXFX6r",unovana,2017-01-21 01:47:23,
"@JeffersonObama @kingsthings Hmm, maybe they're just upset that Larry works for #Putin now.",WolfNW,2017-01-21 01:47:22,
Fingers crossed that Putin shows up for the parade. Shirtless and riding a pony in celebration of his new personal assistant. #inauguration,maddebelle,2017-01-21 01:47:18,
jfc - u're actually claiming Corbyn keeps the company of Putin (who isn't a lefty) & two dead South Americans,davesmith_109,2017-01-21 01:47:15,
"Bueno Putin , pues ya esta. Donald Trump ya es mas poderoso que tu. Tenias un video por ahi no? Dale al play. pic.twitter.com/wKATTq2moG",Homo__Catalanus,2017-01-21 01:47:14,
This is Putin 's President... We must protect our American Democracy from trump and his evil gang. We have to stop... http:// fb.me/1GRk7otS1,MizJette,2017-01-21 01:47:13,
Is Comrade Chris @MSNBCChris keeping #Putin up-to-date on the phone while the parade moves along? @MSNBC #InaugurateTheResistance,SquareInDaNuts,2017-01-21 01:47:11,
"To u idiots who r upset.This is what happens when u have what amounted to a Putin ,Assange,FBI coup d'etat to get a fascist plutocrat elected https:// twitter.com/bakedalaska/st atus/822557655541706752 …",LeoKapakosNY,2017-01-21 01:47:10,
