One of them should have been Putin .,tweetwen115,2017-01-21 02:30:58,
Vielleicht auch von Putin ? ;),_MHofmeister,2017-01-21 02:30:56,
You have to fight him with EVERYTHING. PROVE HIS COLLUSION WITH PUTIN . GET HIS TAXES! You're not helpless! @LindseyGrahamSC @SenJohnMcCain https:// twitter.com/SenSchumer/sta tus/822569430672666624 …,plausible4me,2017-01-21 02:30:54,
One like from Putin . #Trump #TrumpInauguration pic.twitter.com/BHObDJ1Bas,ibutenko,2017-01-21 02:30:53,
putin je suis dégoûter jamais il m'appelle à moi,Alicia061928,2017-01-21 02:30:53,
@Maggyw519 @DrJillStein More likely she is spreading it because she is a pawn of Putin 's,LarryJFeller3,2017-01-21 02:30:52,
"#suckitupbuttercup it's going to continue. Putin gave him a win, not respect",Fleacatt,2017-01-21 02:30:50,
"Putin doesn't control him, they just had data relevant to the election.",hansolo3736,2017-01-21 02:30:50,
Russian hack? Or intentional nod to Putin from Trumppet? Only Golden Shower boy will know... https:// twitter.com/FullFrontalSam B/status/822226723701919744 …,producerguyca,2017-01-21 02:30:50,
#TPMPFaitDuSki Putin je suis dégoûté,Ado49150,2017-01-21 02:30:48,
We just gave ALL INTEL to man who owes Putin for lying about their meeting & relationship. Plz watch Trump 13 &15 Interviews.,IreneDifJen,2017-01-21 02:30:48,
"They're the ones who sold out Gaea: destroying the resources, & soon Exxon drilling​ Siberia's oil for Putin via Trump!",JulieSczesny,2017-01-21 02:30:46,
"@BonnieKOliver it's ironic, since DNC has been vetted; GOP was ALSO hacked by Putin : who knows what kompromat Putin holds on them?",feefer2,2017-01-21 02:30:46,
"This is Goodbye to USA as superpower, viva Putin ...",swisswatch_cz,2017-01-21 02:30:41,
"“Trump, Putin and the Pipelines to Nowhere” by @AlexSteffen https:// medium.com/@AlexSteffen/t rump-putin-and-the-pipelines-to-nowhere-742d745ce8fd#.22hm4hlpc …",j2r2jones,2017-01-21 02:30:41,
Is Vladimir Putin on twitter? It's a big day for him! Curious if he brags about himself the same way his puppet @realDonaldTrump does.,mattpitman,2017-01-21 02:30:30,
Can people just calm the fuck down? At least Trump and Putin isnt getting a gay marriage!,Napoleonwithamg,2017-01-21 02:30:28,
Dieser Putin muss übernatürliche Kräfte besitzen. Hackt Wahlen und Personen.,baronofstone,2017-01-21 02:30:27,
add Theresa May and Putin to the list,Razwan_Mahmood,2017-01-21 02:30:24,
газовая установка на фольксваген пассат б7 Харьков #Putin http://www. vipservicegas.com/our_services/l pg_installation/ustanovka-gbo-na-tsi-fsi-motori/ …,silreitina,2017-01-21 02:30:19,
"BREAKING: Trump will now attend Liberty and Freedom Ball, Salute to Our Armed Services Ball, and Putin 's Balls. #ResistFromDay1",MattyIceUS,2017-01-21 02:30:12,
@Grandma_Shelia And Vladimir Putin .,kimcolley,2017-01-21 02:30:11,
Close ally of Vladimir Putin is attending Donald Trump’s inauguration http://www. palmerreport.com/politics/close -ally-of-vladimir-putin-is-attending-donald-trumps-inauguration/1005/ … via @PalmerReport,haroldkatkov,2017-01-21 02:30:11,
"Now that Trump is president, let's talk about Vladimir #Putin http:// s.einnews.com/X1Mw9UVNgP #Russia",EINRussiaNews,2017-01-21 02:30:07,
"trump endorsed racism, nationalism and hatred. i'm not a socialist, still think that man is dangerous. he is like Putin",barftolmai,2017-01-21 02:30:03,
Is Putin supposed to be Rasputin?,only_a_comment,2017-01-21 02:30:03,
Military Fashion from Conway? Is Putin already installed in the oval office? http:// fb.me/6zxiyL6RZ,MizJette,2017-01-21 02:30:03,
Putin Mais faites vous discret après la défaite d'hier svp https:// twitter.com/gilinskyzz/sta tus/822166489440677894 …,_Bens_M,2017-01-21 02:30:01,
"Putin overjoyed at eagerly awaited ""You're Hired!"" Email. #putin #trump #inauguration pic.twitter.com/aI4MTDQv58",lingeron1,2017-01-21 02:30:01,
@Hardcoresofti tja ... Amis hatten seit 12 Jahren keine Gehaltserhöhungen mehr ... und Putin zeigt denen trotzdem Härte #k ?,MissusAnghel,2017-01-21 02:30:01,
Quel but il avait mit putin,MisterPalmieri6,2017-01-21 02:30:00,
protestors bought for you by vladimir putin in honor of donald trump.,yankeedoodler2,2017-01-21 02:29:51,
"Siempre será mejor que Trump y Putin tengan una buena relación que la III Guerra Mundial, en mi modesta opinión.",todos_lumpen,2017-01-21 02:29:51,
"Trump ist Rassist, Sexist, Homophob, geg. Minderheiten, Egoist + dem Friedensbringer Putin nahe - wow",SystemOfaKorn,2017-01-21 02:29:46,
"It should be her being sworn in, not Putin 's puppet!",spearsmariel,2017-01-21 02:29:42,
not funny. many civilists died in Aleppo which had nothing to do w.rebels. Putin cared? fuck no,Totenleserin,2017-01-21 02:29:42,
"This is Goodbye to USA as superpower, viva Putin ...",swisswatch_cz,2017-01-21 02:29:39,
let's just say Putin is a happy chappy...,ernest71,2017-01-21 02:29:36,
"this is getting beyond ridiculous now? US has more than 100 bases in countries, Russia 1 or 2. But OMG Putin !",piojoso,2017-01-21 02:29:35,
"That`s good news, Putin might be in danger of losing his sense of humour.",mark_markat,2017-01-21 02:29:32,
@realDonaldTrump Is Vladimir Putin Ivanka's real father? Many people are asking me,SpencerGuth,2017-01-21 02:29:29,
@DanJGross PSA= Putin Satellite Agency,MikeWade8,2017-01-21 02:29:25,
2/ ...compromising sex tapes of Trump. It's that his business could be dependent on infusions of cash from foreign sources and that Putin ..,rich1,2017-01-21 02:29:22,
1/ People are missing the point. The issue isn't Trump making $ from his conflicts of interest. Nor is it that Putin could have...,rich1,2017-01-21 02:29:21,
OMG Why is Trump not wearing a lapel pin/flag? Already sold out to Putin ! Patriot my Ass! @CNN @MSNBC @FoxNews #Inauguration,babbi_r,2017-01-21 02:29:19,
@KevinGUEDJ je te déteste PUTIN .,ruthswag2,2017-01-21 02:29:18,
"Somebody has to keep track of how many die from today on. All opposed to his rule will be in the sights of Putin , Trump, Mossad",PatricioAuthor,2017-01-21 02:29:17,
putin,guille117e,2017-01-21 02:29:12,
PUTIN TRINKT SEHR GERNE VODKA,PutinVodka,2017-01-21 02:29:11,
"putin 's assault on America continues, puppet installed, now he's working the strings",pgrandee10,2017-01-21 02:29:10,
"So, FL pizzeria had special pizza honoring @realdonaldtrump . Wonder if the #Russian caviar came from Putin . #justasking for a friend",Fired_Up_2016,2017-01-21 02:29:10,
#Putin at the moment #trump became #president if USA pic.twitter.com/HgjIsFkTk4,dlhmarketing,2017-01-21 02:29:07,
Besiyotya inyama sesilapha nje,Putin_____02,2017-01-21 02:29:04,
"oh that. Welk you know what that means, putin stretched his finger and gave an order.",aveskamp89,2017-01-21 02:29:03,
"Now that Trump is president, let's talk about Vladimir Putin - http://www. cnbc.com/2017/01/20/now -that-trump-is-president-lets-talk-about-vladimir-putin.html …",ceessmit,2017-01-21 02:29:00,
"Pres. Babyhands boasts about his huuuuge crowds and (supposed) mandate...(BTW, the only mandate he has is Putin ! ha!) #Inauguration https:// twitter.com/SKastenbaum/st atus/822502330776088576 …",mariannemeyer,2017-01-21 02:28:55,
#Putin : Emperor = #Trump : Darth Vader #Inauguration #TrumpPresidente,ImWOAD,2017-01-21 02:28:53,
ISIS in Europe is helping Putin 's puppets seize power. Do you really think he's above helping them?,cameron_hai,2017-01-21 02:28:49,
"Når president Putin og en gjeng Frp-ere jubler for samme sak,da blir jeg virkelig bekymret! #Trump",PerOveE,2017-01-21 02:28:43,
Premio “Hugo Chávez a la Paz y la Soberanía de los Pueblos” será entregado a Vladímir Putin https:// goo.gl/fb/lSZQzL,DBenavidesPSUV,2017-01-21 02:28:43,
pic.twitter.com/GMS3Tmb2XT,ExileUA,2017-01-21 02:28:40,
Antoni Segura: “La tenalla Putin -Trump per afeblir Europa és preocupant” http:// ift.tt/2jymWWn,diaribarretina,2017-01-21 02:28:39,
@mic ... Putin doesn't pull any punches in his new country.,shelbyricher,2017-01-21 02:28:32,
Putin has launched attacks pretending to be terrorists. Read thread. https:// twitter.com/JackArmada/sta tus/821072385084420097 …,cameron_hai,2017-01-21 02:28:31,
"Because Obama is not a racist, bigot, sexist pig, draft dodger, Putin sympathizer, etc. need more reasons?",TheJohnBdeHaas,2017-01-21 02:28:26,
Putin .,Ninja4theLord,2017-01-21 02:28:24,
Do you like Putin as much as Don!?!?! Maybe we can be friends.,Tiny_Left_Hand,2017-01-21 02:28:21,
"Austrian far right signs deal with Putin 's party, touts Trump ties http:// reut.rs/2hiQUfa via @Reuters",SeabreezeCheryl,2017-01-21 02:28:20,
"A lot of Americans are thinking just that. But he is going to make America great, or that's what Putin 's told him...",janh1,2017-01-21 02:28:19,
Trump & Putin Lock Lips in Lithuanian Street Art. How Salacious Reality Is. @BuzzFeed @billmaher @sanfranmag @latimes @STimesArtsLife pic.twitter.com/yBtJryKZFn,anthonycarinhas,2017-01-21 02:28:17,
Putin 's Puppet covered for him... #FNC @CNN @kellyannepolls @realDonaldTrump @SpeakerRyan @OfficeGovEthics,Kegan05,2017-01-21 02:28:15,
Amerykanie mają chimerycznego satyra z tupecikiem a kto się cieszy? Putin i Kaczyński. No i może jeszcze Orban.,ilonam007,2017-01-21 02:28:15,
"Fallait même pas que je regarde power, la fin sa ma trop mis l'seumm ah putin",armenienne41,2017-01-21 02:28:14,
HDP!!!mandalo a Putin !!!!,mireya0653,2017-01-21 02:28:13,
actually it's President Vladimir Putin get it right!!!!,TinKaBeLLa_1988,2017-01-21 02:28:09,
"Congrats Putin & Russia - ya did it. Thanks for not going nuclear, i guess.",daveminchala,2017-01-21 02:28:04,
Thought that was Putin for a split second.,iamtiffani,2017-01-21 02:27:59,
Suuure he did. He exposed Putin as a war criminal and bankrupted Russia.,VestigesLCRI,2017-01-21 02:27:52,
"aika kovia olivat mm vaateet uudelleenlaskentaan, väitteet Putin osuudesta etc @dubb633 @TeemuSel8nne",MatiasLahti,2017-01-21 02:27:51,
So what are they calling Putin ? #ResistFromDay1 https:// twitter.com/Telegraph/stat us/822570831498932224 …,TerryLShaw,2017-01-21 02:27:50,
There is a perception - a correct one IMHO - that #trump is trying to destabilise the #eu just like #putin,schestowitz,2017-01-21 02:27:50,
Hillary got 3 million more votes. Doesn't sound like rejection to me. Sounds like Turnip/ Putin used lies and deceit.,joyannheart,2017-01-21 02:27:45,
"Pues yo votaría a Putin ; lo malo , es facha (como casi todos) Lo bueno , no es un come pollas del imperio",cromrey,2017-01-21 02:27:40,
Trump or Putin — Trump because he's not an actual politician althoug... https:// curiouscat.me/2328316168/pos t/84315732?t=1484951260 …,abigailwafer,2017-01-21 02:27:40,
Giving back to Himself the Millionaires & Billionaires & soon sharing the wealth with Putin ! US Oil,Emeraldleah,2017-01-21 02:27:38,
Let's do what we can to unfuck the planet while Putin 's Powerbottom begins his Orange Terror. Fight for the planet. http:// bit.ly/2ie0Lrm,LadySam721,2017-01-21 02:27:37,
Uansett...når både Putin og en gjeng Frp-ere jubler samtidig...Det er ille!,PerOveE,2017-01-21 02:27:31,
Trop bien ! Il est content l'autre bourgeois ! Putin !! #Inauguration,Dalrijyvais,2017-01-21 02:27:28,
"ICARUS: Too long, but interesting & fascinating doc that blows the lid off the Russian doping scandal! Putin is SO corrupt! #sundance pic.twitter.com/OrlmNi6U9f",MovieMantz,2017-01-21 02:27:26,
I love putin and trump best duo ever,agnisland,2017-01-21 02:27:23,
"Whatever they do in Russia is what's going to happen here. Putin is Trump's model, and he'll be glad to advise.",flyaway47,2017-01-21 02:27:21,
hounawa koh lanta . putin merde,TCHIKO94,2017-01-21 02:27:18,
This is the day that Putin became the most powerful man on Earth http:// sostohumanity.blogspot.com/2017/01/putins -revenge-make-russia-greatest.html …,PatricioAuthor,2017-01-21 02:27:16,
BREAKING. Putin code for Trump is Carrot Cake,SparkyTheDoggy,2017-01-21 02:27:10,
Putin has committed $$$ to ensuring Trump remains in power He wouldnt leave that to chance,AJOuellette777,2017-01-21 02:27:07,
HELL NO! He had no respect for a 2x popularly elected POTUS nor the office. Fuck him up his Putin loving ass #notmypresident #IllegitTrump https:// twitter.com/empendell/stat us/822518076067299329 …,estheramma,2017-01-21 02:27:04,
. @armandodkos I wonder if these rioters have been hired by DT and/or Putin 's operatives because they diminish messages of real protesters,grandmahannah,2017-01-21 02:27:02,
"Good news Russian's don't know what we know about Trump only lies from Putin , they don't know Trumps a liar and a faud",Malcy43,2017-01-21 02:26:59,
I Like Putin ..he talks a lot of sense and clearly loves his country.,jillladelus1,2017-01-21 02:26:54,
#Trump and his family are a bunch of crooks - they have major ties with Putin and so does his #NotMyPresident … http:// vitw.it/link/4rwJY,marcylauren,2017-01-21 02:26:50,
the erudition and nuanced sophistication of the Putin fans never ceases to astonish,bibbleco,2017-01-21 02:26:44,
"@ladiesgun Hitler , Putin love the show of force so does ilPOTUS",Capt17Bjk,2017-01-21 02:26:40,
Don likes Putin 's pee pee. Do you like Putin 's pee pee?,Tiny_Left_Hand,2017-01-21 02:26:40,
"it'll help all Americans, which helps the markets, which makes america great again-for the RICH + bonus democracy downfall 4 Putin !",Researcherly,2017-01-21 02:26:36,
Proud to be American? Trump is Putin 's Choice. He is Vlad's puppet. A MINORITY President. So much for democracy!,JamusB,2017-01-21 02:26:29,
Let's just hope Putin wakes you up before noon for your morning bath.,depelated,2017-01-21 02:26:26,
"Watching your PeeOTUS Putin stooge incinerate your whole party, with you in it, will be one of our finest moments. Karma is coming 4 your https:// twitter.com/yashar/status/ 822551891397713921 …",ABlueResister,2017-01-21 02:26:22,
"Trump about to give all American and British classified info to Putin , so no, I don't really care about this case.",dgontheroad,2017-01-21 02:26:19,
"http:// Ancestry.com report is in, @realDonaldTrump and #Putin are in fact kissing cousins. #Inauguration pic.twitter.com/5tKcTe0EFP",TwidiotInChief,2017-01-21 02:26:18,
Our big brother is being a bad example!USA So we have to look to the east! Putin pic.twitter.com/eKmqs9qHaD,Simrama,2017-01-21 02:26:18,
"At least he's not a Putin puppet Senate confirms retired Gen. James Mattis as def secy, breaking with decades of https:// apple.news/Aig2g8zMZTjmMc CiRHr-syA …",RulingVenus,2017-01-21 02:26:17,
Trump loves Putin #FanáticosBahêa,wedafux,2017-01-21 02:26:17,
Protect your own boundaries says Putin and #trump . Come on Theresa..grow some!,annieandersona1,2017-01-21 02:26:15,
"Wieso eigentlich wählen angeblich demokratische Länder solche Leute: #Trump , #Putin , #Erdogan , #Duterte , #Morales , #Maduro , #AfD , #LePen ???",Traumball,2017-01-21 02:26:15,
Rewriting history something Putin taught him,Mr_Zues_1,2017-01-21 02:26:13,
"Here's a musical take on this weird bromance, ""The Trump & Putin Dance"" https://www. youtube.com/watch?v=c09xvB e9diw …",LaurensComedy,2017-01-21 02:26:10,
You mean giving it to Putin .,jonmelim,2017-01-21 02:26:10,
@Lawrence - Putin 's Puppet & Putin 's Spy now occupy the WH,rmscarabin,2017-01-21 02:26:03,
"Dialogue with Putin is the post truth equivalent for ""we don't give a shit if the axis of resistance enslave weaker countries""",DreamescapePs,2017-01-21 02:26:03,
"Prostitutes, Hidden Hotel Camera's: Familiar Putin Tools | Rachel Maddo... https:// youtu.be/uHX031UoCXA via @YouTube",ShaneJFilomena,2017-01-21 02:26:01,
5 Ways Trump's Recent Comments on Europe Signal Putin May Be Getting Everything on His 'Wish List' http:// ijr.com/2017/01/780136 -5-ways-trumps-recent-comments-on-europe-signal-putin-may-be-getting-everything-on-his-wish-list/ …,exhausting,2017-01-21 02:26:00,
So glad you are spending the day celebrating President Putin ! Are you freakin' BLIND?! Or do you simply not care? pic.twitter.com/owakOyJEMm,MillieLou5,2017-01-21 02:25:53,
LIES it was Trump's impending leadership that drove the boom from back when only Putin knew Trump would run...or sumthin'.,jeditigger,2017-01-21 02:25:52,
"Tomorrow, Putin 's protege will say that his crowd was 70,000,000. This will be confirmed by Breitbart. CNN will run with it. https:// twitter.com/DanJGross/stat us/822489914847662080 …",RF_P0TUS,2017-01-21 02:25:49,
Whilst Trump cuddles up with Putin you call Americans communists? https:// twitter.com/_Makada_/statu s/822481628064845825 …,willsspot,2017-01-21 02:25:46,
"""red line"" in syria my ass. putin made him look weak.",babadooky,2017-01-21 02:25:46,
Putin SLAMS Deep State: Same Forces that Did Ukraine Maidan Now Want a C... https:// youtu.be/K9Nah3rZZWE via @YouTube,Herobrine1467,2017-01-21 02:25:43,
Exactly right about Trump and Putin ! You hit the nail on the head buddy!,bustychocolate,2017-01-21 02:25:43,
I'm guessing Putin was happy.. https:// twitter.com/sdutideas/stat us/822567435572310018 …,MarkMMercer,2017-01-21 02:25:39,
= Putin,Omegassualt,2017-01-21 02:25:38,
Bullshit the people voted Hillary Putin Putin his puppet in place for russia never popular you've never accomplished anything on your own,trueamercn,2017-01-21 02:25:36,
President Trump is an evil joke pulled on America by President Putin . #ResistFromDay1 pic.twitter.com/rPnGB16Yl3,imfabulous13,2017-01-21 02:25:34,
He could ask #Putin if he could take care by declaring #SDF / #YPG as an ally... And support them.,GeromanAT,2017-01-21 02:25:31,
one China Policy. Makes more noise broadly in agreement with Putin . Result a very nervous China. Trump then agrees to walk back most of that,cynicq,2017-01-21 02:25:28,
#romania Putin 's Old Moldova Map Alarms Romania - Balkan Insight https:// goo.gl/fb/ZZBC0y,RomanianNews,2017-01-21 02:25:26,
I'm sure http:// RT.com and Putin will compensate him. https:// twitter.com/thehill/status /822568937040842753 …,Yousefzadeh,2017-01-21 02:25:26,
What's the betting on where #Putin moves on first? Ukraine or Baltics?,niknamH,2017-01-21 02:25:24,
Agreed! The scariest parts though lay in the nominees he has chosen who will work on behalf of Big Oil & Putin . https:// twitter.com/kurteichenwald /status/822514945765953536 …,sherylmosher,2017-01-21 02:25:14,
I live in Los Angeles you tiny dick Child molester. The the child you molested was your sister. You spied for Putin punk,gemarble357,2017-01-21 02:25:11,
The MSM did a horrible job covering the election. Trump and Putin got a free ride from the Media.,AnnaVarela2,2017-01-21 02:25:07,
"PUTIN 'S PICK FOR PRESIDENT, YOU KNOW TRUMP'S A TRAITOR HE'S AN INSURGENT FOR PUTIN 'S IT LOOKS LIKE YOU'RE A PUTIN FAN TO!",zjparker5310,2017-01-21 02:25:02,
"Or any other group that pops up refusing the Agreements worked out by Putin & Erdogan, Look for Terror attacks in Turkey",23466510fox6152,2017-01-21 02:25:00,
How is the mirage and fiction of Putin 's personality crated and maintained? By dumbing-down claims such as this... http:// fb.me/5iseTlu50,SuchanVladimir,2017-01-21 02:24:53,
"I didn't say he's not my president. He did. However, if it's revealed he/his staff collaborated w/ Putin to meddle in the election...",LKNWoman,2017-01-21 02:24:50,
@realDonaldTrump you were putin 's puppet but i now realize that you are steve bannon's puppet.your views are not what all americans want to,bentlybooboo,2017-01-21 02:24:49,
Putin ... Start the reactor. https:// twitter.com/ThePixelFactor /status/822565068269383681 …,thenamescliff,2017-01-21 02:24:48,
"I'm writing the sequel to ""How the Grinch Stole Christmas!""...I call it ""How Putin Stole The US!""",KingJordo76,2017-01-21 02:24:46,
"Goodbye USA superpower, viva Putin ...",swisswatch_cz,2017-01-21 02:24:45,
my home page post has Trump videos admitting met & relationship. Putin been lying & sharing secret wDT. Please care!?,IreneDifJen,2017-01-21 02:24:42,
"And if you think they hate what is happening today, imagine how everyone else in the world feels!!!! Except Putin .",Fackingfulcans,2017-01-21 02:24:42,
"Eso es una conjetura. Pero el Islam en Primaria implantado por @PPopular es una certeza. Ésto en España, ni Putin ni Trump",Vityspain,2017-01-21 02:24:39,
La diferencia entre WhatsApp y Telegram es que tus mensajes privados los lea el negro mierda Obama o el putísimo amo Putin .,aniruel_ewoks,2017-01-21 02:24:39,
Trump is the biggest threat to democracy & voter suppression is abt to go on steroids. Putin wnts democracy to die2 http:// ln.is/www.thenation. com/ar/TaTSM …,solaranoir,2017-01-21 02:24:37,
The spent an inordinate amount of time on Clinton's emails. Putin is the only person he's afraid of...why?,LauraKahn1,2017-01-21 02:24:34,
Putin to visit Hungary February 2 – Budapest http://www. rappler.com/world/regions/ europe/158919-putin-visit-hungary-february … via @rapplerdotcom,JEyal_RUSI,2017-01-21 02:24:34,
J'arrête pas de rire j'en peux plus putin #TPMPFaitDuSki #TPMP #TPMPauSki c'est les meilleurs,MelissaDupuis1,2017-01-21 02:24:33,
Apologies for RayBan ads everyone... someone got my password somehow. Damn Putin .,robert_etc,2017-01-21 02:24:32,
"All Drama has begun, Crying for Aleppo , Palestine lol. I support Assad and Putin . IS go to hell",sabkilengayab,2017-01-21 02:24:31,
Gender Twitter https:// twitter.com/dopeez12/statu s/822346505889714176 …,Putin_____02,2017-01-21 02:24:26,
Vladimir Putin enjoying the inauguration coverage! pic.twitter.com/ibrMEa2scg,dmgoode,2017-01-21 02:24:25,
"Vikings c'est putin de lourd, regardez moi ce chef d'oeuvre",DanyCatarino,2017-01-21 02:24:24,
"#Inauguration @hardball @HardballChris @MSNBC @maddow Romanovs? There is his connection to Putin , but who's trump's Rasputin? Bannon",coople,2017-01-21 02:24:23,
"ITALIA SOTTO LA NEVE, COSÌ PUTIN CI OFFRE SOCCORSO: ""PRONTO AD INVIARE UNA TASK-FORCE DI PROFESSIONISTI"" http:// fb.me/6cK6atqEI",annaserra10,2017-01-21 02:24:15,
#News #ICYMI #Editorial #Cartoon #Putin #Inauguration #USPolitics #USPoli https:// twitter.com/TheoMoudakis/s tatus/822496452668702720 …,MelbaGirard,2017-01-21 02:24:14,
If only you stopped adoring Putin .,StaszekDec,2017-01-21 02:24:13,
We can't have a Putin ally heading the US government AND the state department. Call your senators -- NO on Tillerson!,UnitedDems,2017-01-21 02:24:10,
"- in the very first paragraph he thanked the American people and the ""world"" (Russia/ Putin ) ?",mpitta94587,2017-01-21 02:24:08,
"He's not your President, Putin is.",NewWorldReality,2017-01-21 02:24:06,
"ITALIA SOTTO LA NEVE, COSÌ PUTIN CI OFFRE SOCCORSO: ""PRONTO AD INVIARE UNA TASK-FORCE DI PROFESSIONISTI"" http:// fb.me/7rYAWnfoT",annaserra10,2017-01-21 02:24:05,
On putin elle ma tuer cela avec son massage orientale massage harrissa mdr #TPMPFaitDuSki,melissaranikens,2017-01-21 02:24:05,
Been told by a very reliable source that @realDonaldTrump had his scrotum and balls removed in exchange for Putin 's hackers services.,th3siggy,2017-01-21 02:24:00,
From reality. Obama put on the sanctions. Putin installed Trump to remove them. You are clueless.,VestigesLCRI,2017-01-21 02:23:59,
But #Putin tho. :| And #Russia & stuff… |:,SinicalNihilizt,2017-01-21 02:23:52,
tell her her president is Russia's puppet & putin has his hand so far up his ass he can touch the taco bowl he had for lunch,TrevorIsAKing,2017-01-21 02:23:45,
so much respect that he and Putin arranged to cheat Hillary out of her win.,AngelaAGarner,2017-01-21 02:23:44,
"TimTEC commented on Donald Trump's national security chief 'took money from Putin and Erdogan', says former NSA employee | p://ind.pn/2jyq0l",pierrecot,2017-01-21 02:23:39,
Lookout this...A cute cartoon showed up in my Twitter feed showing Putin handing the keys of Government back to @realDonaldTrump . So special pic.twitter.com/P5IX7wJBEN,JT_BLACKWELL,2017-01-21 02:23:39,
Do you have that picture of Putin 's confused face over the whole peaceful transition thing? Must be disappointed with his buddy. https:// twitter.com/ninabyzantina/ status/822549613538377730 …,atpapanik,2017-01-21 02:23:36,
And Putin has nothing to do with Trump. He merely wants to calm US to forge global peace. Hilary just a horrible candidate,AlterWriter,2017-01-21 02:23:22,
"Soy de ese 1% que piensa que Obama y Mujica son unos pendejos, comparados con Putin y Merkel",javierambriz,2017-01-21 02:23:19,
"Wiem,ze ma Panbardzo trzeźwą ocenę spraw w PL i na świecie.I zgadzam się z Panem,że Putin odbudowuje Imperium.I,że @realDonaldTrump niepokoi https:// twitter.com/russianclimate s/status/822562658402582530 …",ProtasiewiczJ,2017-01-21 02:23:16,
Austrian nationalists align with PUTIN who Bannon aligns with Trump now working to get marine Le pen elected and Merkelout!,msgoddessrises,2017-01-21 02:23:15,
C'est trop beau putin ( ça sera pareil hein @iMelyyy ? ),Spykks,2017-01-21 02:23:14,
I like Putin more and more every day. Glad he's gonna be an ally now.,ChaosApathy,2017-01-21 02:23:11,
"most likely paid by Trump, PUTIN or some other agitation group.",RobinBrenizer,2017-01-21 02:23:09,
"@jasoninthehouse I hope you are happy to have DT as President.If you feel that is great,then guess you are in with Putin as well.",ccs4916,2017-01-21 02:23:05,
"The only thing that could have made this better is if you had invited Putin , like Regan Gorbachev, Fuck the Liberal Media; Only go on Fox https:// twitter.com/realDonaldTrum p/status/822502601304526848 …",World_of_Rath,2017-01-21 02:23:03,
